,user_input,retrieved_contexts,response,reference,answer_relevancy,context_precision,faithfulness,context_recall,answer_correctness
0,What is definition of DBMS?,"['###### A database-management system (DBMS) is a collection of interrelated data and a set of programs to access those data. The collection of data, usually referred to as the database, contains information relevant to an enterprise. The primary goal of a DBMS is to provide a way to store and retrieve database information that is both convenient and efficient.\n Database systems are designed to manage large bodies of information. Man agement of data involves both defining structures for storage of information and providing mechanisms for the manipulation of information. In addition, the database system must ensure the safety of the information stored, despite system crashes or attempts at unauthorized access. If data are to be shared among several users, the system must avoid possible anomalous results.', '###### A database-management system (DBMS) is a collection of interrelated data and a set of programs to access those data. The collection of data, usually referred to as the database, contains information relevant to an enterprise. The primary goal of a DBMS is to provide a way to store and retrieve database information that is both convenient and efficient.\n Database systems are designed to manage large bodies of information. Man agement of data involves both defining structures for storage of information and providing mechanisms for the manipulation of information. In addition, the database system must ensure the safety of the information stored, despite system crashes or attempts at unauthorized access. If data are to be shared among several users, the system must avoid possible anomalous results.', '1.14 Summary\n\n • A database-management system (DBMS) consists of a collection of interre lated data and a collection of programs to access that data. The data describe one particular enterprise.\n\n • The primary goal of a DBMS is to provide an environment that is both conve nient and efficient for people to use in retrieving and storing information.\n\n • Database systems are ubiquitous today, and most people interact, either di rectly or indirectly, with databases many times every day.\n\n • Database systems are designed to store large bodies of information. The man agement of data involves both the definition of structures for the storage of information and the provision of mechanisms for the manipulation of infor- mation. In addition, the database system must provide for the safety of the information stored, in the face of system crashes or attempts at unauthorized access. If data are to be shared among several users, the system must avoid possible anomalous results.\n\n\n-----', '1.14 Summary\n\n • A database-management system (DBMS) consists of a collection of interre lated data and a collection of programs to access that data. The data describe one particular enterprise.\n\n • The primary goal of a DBMS is to provide an environment that is both conve nient and efficient for people to use in retrieving and storing information.\n\n • Database systems are ubiquitous today, and most people interact, either di rectly or indirectly, with databases many times every day.\n\n • Database systems are designed to store large bodies of information. The man agement of data involves both the definition of structures for the storage of information and the provision of mechanisms for the manipulation of infor- mation. In addition, the database system must provide for the safety of the information stored, in the face of system crashes or attempts at unauthorized access. If data are to be shared among several users, the system must avoid possible anomalous results.\n\n\n-----', '• Specialized users are sophisticated users who write specialized database\n applications that do not fit into the traditional data-processing framework. Among these applications are computer-aided design systems, knowledge- base and expert systems, systems that store data with complex data types (for example, graphics data and audio data), and environment-modeling systems. Chapter 22 covers several of these applications.\n\n**1.12.2** **Database Administrator**\n\n###### One of the main reasons for using DBMSs is to have central control of both the data and the programs that access those data. A person who has such central control over the system is called a database administrator (DBA). The functions of a DBA include:\n\n • Schema definition. The DBA creates the original database schema by execut ing a set of data definition statements in the DDL.', '• Specialized users are sophisticated users who write specialized database\n applications that do not fit into the traditional data-processing framework. Among these applications are computer-aided design systems, knowledge- base and expert systems, systems that store data with complex data types (for example, graphics data and audio data), and environment-modeling systems. Chapter 22 covers several of these applications.\n\n**1.12.2** **Database Administrator**\n\n###### One of the main reasons for using DBMSs is to have central control of both the data and the programs that access those data. A person who has such central control over the system is called a database administrator (DBA). The functions of a DBA include:\n\n • Schema definition. The DBA creates the original database schema by execut ing a set of data definition statements in the DDL.']",A database-management system (DBMS) is a collection of interrelated data and a set of programs to access those data. The primary goal of a DBMS is to provide a way to store and retrieve database information that is both convenient and efficient. It consists of data describing one particular enterprise.,A database-management system (DBMS) is a collection of interrelated data and a set of programs to access those data.,0.8771946048586013,0.9666666666473333,0.4,1.0,0.5160510504730291
1,Please tell me some representative examples of Database applications.,"['1.1 Database-System Applications\n\n Databases are widely used. Here are some representative applications:\n\n • Enterprise Information\n\n ◦ Sales: For customer, product, and purchase information.\n ◦ Accounting: For payments, receipts, account balances, assets and other\n accounting information.\n\n ◦ Human resources: For information about employees, salaries, payroll taxes,\n and benefits, and for generation of paychecks.\n\n ◦ Manufacturing: For management of the supply chain and for tracking pro duction of items in factories, inventories of items in warehouses and stores, and orders for items.\n\n**1**\n\n\n-----', '1.1 Database-System Applications\n\n Databases are widely used. Here are some representative applications:\n\n • Enterprise Information\n\n ◦ Sales: For customer, product, and purchase information.\n ◦ Accounting: For payments, receipts, account balances, assets and other\n accounting information.\n\n ◦ Human resources: For information about employees, salaries, payroll taxes,\n and benefits, and for generation of paychecks.\n\n ◦ Manufacturing: For management of the supply chain and for tracking pro duction of items in factories, inventories of items in warehouses and stores, and orders for items.\n\n**1**\n\n\n-----', 'Exercises\n\n 1.7 List four applications you have used that most likely employed a database system to store persistent data.\n\n 1.8 List four significant differences between a file-processing system and a\nDBMS.\n\n###### 1.9 Explain the concept of physical data independence, and its importance in database systems.\n\n 1.10 List five responsibilities of a database-management system. For each re- sponsibility, explain the problems that would arise if the responsibility were not discharged.\n\n 1.11 List at least two reasons why database systems support data manipulation using a declarative query language such as SQL, instead of just providing a a library of C or C++ functions to carry out data manipulation.\n\n 1.12 Explain what problems are caused by the design of the table in Figure 1.4.\n\n 1.13 What are five main functions of a database administrator?\n\n 1.14 Explain the difference between two-tier and three-tier architectures. Which is better suited for Web applications? Why?', 'Exercises\n\n 1.7 List four applications you have used that most likely employed a database system to store persistent data.\n\n 1.8 List four significant differences between a file-processing system and a\nDBMS.\n\n###### 1.9 Explain the concept of physical data independence, and its importance in database systems.\n\n 1.10 List five responsibilities of a database-management system. For each re- sponsibility, explain the problems that would arise if the responsibility were not discharged.\n\n 1.11 List at least two reasons why database systems support data manipulation using a declarative query language such as SQL, instead of just providing a a library of C or C++ functions to carry out data manipulation.\n\n 1.12 Explain what problems are caused by the design of the table in Figure 1.4.\n\n 1.13 What are five main functions of a database administrator?\n\n 1.14 Explain the difference between two-tier and three-tier architectures. Which is better suited for Web applications? Why?', '1.13 What are five main functions of a database administrator?\n\n 1.14 Explain the difference between two-tier and three-tier architectures. Which is better suited for Web applications? Why?\n\n 1.15 Describe at least 3 tables that might be used to store information in a social-networking system such as Facebook.\n\n Tools\n\n There are a large number of commercial database systems in use today. The major ones include: IBM DB2 (www.ibm.com/software/data/db2), Oracle (www.oracle.com), Microsoft SQL Server (www.microsoft.com/sql), Sybase (www.sybase.com), and IBM Informix (www.ibm.com/software/data/informix). Some of these systems are available\n\n\n-----', '1.13 What are five main functions of a database administrator?\n\n 1.14 Explain the difference between two-tier and three-tier architectures. Which is better suited for Web applications? Why?\n\n 1.15 Describe at least 3 tables that might be used to store information in a social-networking system such as Facebook.\n\n Tools\n\n There are a large number of commercial database systems in use today. The major ones include: IBM DB2 (www.ibm.com/software/data/db2), Oracle (www.oracle.com), Microsoft SQL Server (www.microsoft.com/sql), Sybase (www.sybase.com), and IBM Informix (www.ibm.com/software/data/informix). Some of these systems are available\n\n\n-----']","Some representative examples of database applications include sales systems for customer, product, and purchase information, accounting systems for payments, receipts, and account balances, human resources systems for employee information, and manufacturing systems for supply chain management and production tracking.","Database can be used for Enterprise Information, Banking and Finance, Universities, Airlines and Telecommunication so on.",0.9715061222547225,0.99999999995,0.6666666666666666,1.0,0.21512590249348312
2,What kinds of data storage is used in 1950s?,"['• Late 1960s and 1970s: Widespread use of hard disks in the late 1960s changed\n the scenario for data processing greatly, since hard disks allowed direct access to data. The position of data on disk was immaterial, since any location on disk could be accessed in just tens of milliseconds. Data were thus freed from\n\n\n-----', '• Late 1960s and 1970s: Widespread use of hard disks in the late 1960s changed\n the scenario for data processing greatly, since hard disks allowed direct access to data. The position of data on disk was immaterial, since any location on disk could be accessed in just tens of milliseconds. Data were thus freed from\n\n\n-----', '• 1950s and early 1960s: Magnetic tapes were developed for data storage. Data\n processing tasks such as payroll were automated, with data stored on tapes. Processing of data consisted of reading data from one or more tapes and writing data to a new tape. Data could also be input from punched card decks, and output to printers. For example, salary raises were processed by entering the raises on punched cards and reading the punched card deck in synchronization with a tape containing the master salary details. The records had to be in the same sorted order. The salary raises would be added to the salary read from the master tape, and written to a new tape; the new tape would become the new master tape.\n Tapes (and card decks) could be read only sequentially, and data sizes were\n much larger than main memory; thus, data processing programs were forced to process data in a particular order, by reading and merging data from tapes and card decks.', '• 1950s and early 1960s: Magnetic tapes were developed for data storage. Data\n processing tasks such as payroll were automated, with data stored on tapes. Processing of data consisted of reading data from one or more tapes and writing data to a new tape. Data could also be input from punched card decks, and output to printers. For example, salary raises were processed by entering the raises on punched cards and reading the punched card deck in synchronization with a tape containing the master salary details. The records had to be in the same sorted order. The salary raises would be added to the salary read from the master tape, and written to a new tape; the new tape would become the new master tape.\n Tapes (and card decks) could be read only sequentially, and data sizes were\n much larger than main memory; thus, data processing programs were forced to process data in a particular order, by reading and merging data from tapes and card decks.', 'The 1980s also saw much research on parallel and distributed databases,\n as well as initial work on object-oriented databases.', 'The 1980s also saw much research on parallel and distributed databases,\n as well as initial work on object-oriented databases.']","In the 1950s, data storage was primarily done using magnetic tapes for tasks such as payroll automation. Data was read from tapes and written to new tapes, with input also possible from punched card decks. Data processing programs were designed to process data sequentially from tapes and card decks due to the limitations of the storage methods available at that time.","Magnetic tapes were developed for data storage. Data processing tasks such as payroll were automated, with data stored on tapes.",0.9503867406342178,0.4166666666458333,0.8333333333333334,1.0,0.5084624643294786
3,Relational model concept is defined by whom? Please tell me his/her name.,"['###### A data model is a collection of conceptual tools for describing data, data relation- ships, data semantics, and consistency constraints. In this part, we focus on the relational model.\n The relational model, which is covered in Chapter 2, uses a collection of tables\n to represent both data and the relationships among those data. Its conceptual simplicity has led to its widespread adoption; today a vast majority of database products are based on the relational model. The relational model describes data at the logical and view levels, abstracting away low-level details of data storage. The entity-relationship model, discussed later in Chapter 7 (in Part 2), is a higher-level data model which is widely used for database design.', '###### A data model is a collection of conceptual tools for describing data, data relation- ships, data semantics, and consistency constraints. In this part, we focus on the relational model.\n The relational model, which is covered in Chapter 2, uses a collection of tables\n to represent both data and the relationships among those data. Its conceptual simplicity has led to its widespread adoption; today a vast majority of database products are based on the relational model. The relational model describes data at the logical and view levels, abstracting away low-level details of data storage. The entity-relationship model, discussed later in Chapter 7 (in Part 2), is a higher-level data model which is widely used for database design.', 'The relational model is an example of a record-based model. Record-based\n models are so named because the database is structured in fixed-format records of several types. Each table contains records of a particular type. Each record type defines a fixed number of fields, or attributes. The columns of the table correspond to the attributes of the record type.\n It is not hard to see how tables may be stored in files. For instance, a special\n character (such as a comma) may be used to delimit the different attributes of a record, and another special character (such as a new-line character) may be used to delimit records. The relational model hides such low-level implementation details from database developers and users.\n We also note that it is possible to create schemas in the relational model that', 'The relational model is an example of a record-based model. Record-based\n models are so named because the database is structured in fixed-format records of several types. Each table contains records of a particular type. Each record type defines a fixed number of fields, or attributes. The columns of the table correspond to the attributes of the record type.\n It is not hard to see how tables may be stored in files. For instance, a special\n character (such as a comma) may be used to delimit the different attributes of a record, and another special character (such as a new-line character) may be used to delimit records. The relational model hides such low-level implementation details from database developers and users.\n We also note that it is possible to create schemas in the relational model that', '**1.4** **Database Languages** **9**\n\n###### There are a number of different data models that we shall cover in the text.\n The data models can be classified into four different categories:\n\n • Relational Model. The relational model uses a collection of tables to repre sent both data and the relationships among those data. Each table has mul- tiple columns, and each column has a unique name. Tables are also known as relations. The relational model is an example of a record-based model. Record-based models are so named because the database is structured in fixed-format records of several types. Each table contains records of a par- ticular type. Each record type defines a fixed number of fields, or attributes. The columns of the table correspond to the attributes of the record type. The relational data model is the most widely used data model, and a vast major- ity of current database systems are based on the relational model. Chapters 2 through 8 cover the relational model in detail.', '**1.4** **Database Languages** **9**\n\n###### There are a number of different data models that we shall cover in the text.\n The data models can be classified into four different categories:\n\n • Relational Model. The relational model uses a collection of tables to repre sent both data and the relationships among those data. Each table has mul- tiple columns, and each column has a unique name. Tables are also known as relations. The relational model is an example of a record-based model. Record-based models are so named because the database is structured in fixed-format records of several types. Each table contains records of a par- ticular type. Each record type defines a fixed number of fields, or attributes. The columns of the table correspond to the attributes of the record type. The relational data model is the most widely used data model, and a vast major- ity of current database systems are based on the relational model. Chapters 2 through 8 cover the relational model in detail.']",The relational model concept is defined by Edgar F. Codd.,"A landmark paper by Codd [1970] defined the relational model and nonprocedural ways of querying data in the relational model, and relational databases were born.",0.9136994998827673,0.8766666666491333,0.0,0.0,0.521584924643189
4,What is DML and DDL?,"['**10** **Chapter 1** **Introduction**\n\n###### dates. In practice, the data-definition and data-manipulation languages are not two separate languages; instead they simply form parts of a single database lan- guage, such as the widely used SQL language.\n\n**1.4.1** **Data-Manipulation Language**\n\n###### A data-manipulation language (DML) is a language that enables users to access or manipulate data as organized by the appropriate data model. The types of access are:\n\n • Retrieval of information stored in the database\n • Insertion of new information into the database\n • Deletion of information from the database\n • Modification of information stored in the database\n\n There are basically two types:\n\n • Procedural DMLs require a user to specify what data are needed and how to\n get those data.\n\n • Declarative DMLs (also referred to as nonprocedural DMLs) require a user to\n specify what data are needed without specifying how to get those data.', '**10** **Chapter 1** **Introduction**\n\n###### dates. In practice, the data-definition and data-manipulation languages are not two separate languages; instead they simply form parts of a single database lan- guage, such as the widely used SQL language.\n\n**1.4.1** **Data-Manipulation Language**\n\n###### A data-manipulation language (DML) is a language that enables users to access or manipulate data as organized by the appropriate data model. The types of access are:\n\n • Retrieval of information stored in the database\n • Insertion of new information into the database\n • Deletion of information from the database\n • Modification of information stored in the database\n\n There are basically two types:\n\n • Procedural DMLs require a user to specify what data are needed and how to\n get those data.\n\n • Declarative DMLs (also referred to as nonprocedural DMLs) require a user to\n specify what data are needed without specifying how to get those data.', '• Declarative DMLs (also referred to as nonprocedural DMLs) require a user to\n specify what data are needed without specifying how to get those data.\n\n Declarative DMLs are usually easier to learn and use than are procedural', '• Declarative DMLs (also referred to as nonprocedural DMLs) require a user to\n specify what data are needed without specifying how to get those data.\n\n Declarative DMLs are usually easier to learn and use than are procedural', '• A data-definition language (DDL) is a language for specifying the database\n schema and as well as other properties of the data.\n\n • Database design mainly involves the design of the database schema. The\n entity-relationship (E-R) data model is a widely used data model for database design. It provides a convenient graphical representation to view data, rela- tionships, and constraints.\n\n • A database system has several subsystems.\n ◦ The storage manager subsystem provides the interface between the low level data stored in the database and the application programs and queries submitted to the system.\n\n\n###### ◦ The query processor subsystem compiles and executes DDL and DML\n statements.\n\n • Transaction management ensures that the database remains in a consistent\n (correct) state despite system failures. The transaction manager ensures that concurrent transaction executions proceed without conflicting.', '• A data-definition language (DDL) is a language for specifying the database\n schema and as well as other properties of the data.\n\n • Database design mainly involves the design of the database schema. The\n entity-relationship (E-R) data model is a widely used data model for database design. It provides a convenient graphical representation to view data, rela- tionships, and constraints.\n\n • A database system has several subsystems.\n ◦ The storage manager subsystem provides the interface between the low level data stored in the database and the application programs and queries submitted to the system.\n\n\n###### ◦ The query processor subsystem compiles and executes DDL and DML\n statements.\n\n • Transaction management ensures that the database remains in a consistent\n (correct) state despite system failures. The transaction manager ensures that concurrent transaction executions proceed without conflicting.']","DML stands for Data Manipulation Language, which enables users to access or manipulate data in a database through operations like retrieval, insertion, deletion, and modification. DDL stands for Data Definition Language, used for specifying the database schema and other data properties, including creating and modifying database structures. Both DML and DDL are essential components of a database language like SQL.",A data-manipulation language (DML) is a language that enables users to access or manipulate data. And a data-definition language (DDL) is a language for specifying the database schema and as well as other properties of the data.,0.9450577708975914,0.9999999999833333,1.0,1.0,0.7025546718220921
5,Please briefly introduce the disadvantages of managing structural data using the file system.,"['This typical file-processing system is supported by a conventional operat ing system. The system stores permanent records in various files, and it needs different application programs to extract records from, and add records to, the ap- propriate files. Before database management systems (DBMSs) were introduced, organizations usually stored information in such systems.\n Keeping organizational information in a file-processing system has a number\n of major disadvantages:', 'This typical file-processing system is supported by a conventional operat ing system. The system stores permanent records in various files, and it needs different application programs to extract records from, and add records to, the ap- propriate files. Before database management systems (DBMSs) were introduced, organizations usually stored information in such systems.\n Keeping organizational information in a file-processing system has a number\n of major disadvantages:', 'The point here is that conventional file-processing environments do not\n allow needed data to be retrieved in a convenient and efficient manner. More responsive data-retrieval systems are required for general use.', 'The point here is that conventional file-processing environments do not\n allow needed data to be retrieved in a convenient and efficient manner. More responsive data-retrieval systems are required for general use.', '**4** **Chapter 1** **Introduction**\n\n###### • Data redundancy and inconsistency. Since different programmers create\n the files and application programs over a long period, the various files are likely to have different structures and the programs may be written in several programming languages. Moreover, the same information may be duplicated in several places (files). For example, if a student has a double major (say, music and mathematics) the address and telephone number of that student may appear in a file that consists of student records of students in the Music department and in a file that consists of student records of students in the Mathematics department. This redundancy leads to higher storage and access cost. In addition, it may lead to data inconsistency; that is, the various copies of the same data may no longer agree. For example, a changed student address may be reflected in the Music department records but not elsewhere in the system.', '**4** **Chapter 1** **Introduction**\n\n###### • Data redundancy and inconsistency. Since different programmers create\n the files and application programs over a long period, the various files are likely to have different structures and the programs may be written in several programming languages. Moreover, the same information may be duplicated in several places (files). For example, if a student has a double major (say, music and mathematics) the address and telephone number of that student may appear in a file that consists of student records of students in the Music department and in a file that consists of student records of students in the Mathematics department. This redundancy leads to higher storage and access cost. In addition, it may lead to data inconsistency; that is, the various copies of the same data may no longer agree. For example, a changed student address may be reflected in the Music department records but not elsewhere in the system.']","Managing structural data using a file system can lead to data redundancy and inconsistency due to different structures and programming languages used by various programmers over time. This redundancy increases storage and access costs and can result in data inconsistencies across different copies of the same data. For example, changes in one department's records may not be reflected elsewhere in the system, causing potential issues with data accuracy and integrity.","File system may have data redundancy and inconsistency, difficulty in accessing data, data isolation problem, integrity problem, atomcity problem, and concurrent access anomalies.",0.9345483770872786,0.9999999999833333,1.0,0.3333333333333333,0.6900352019687609
6,Please tell me specifically about the atomity problem in the file system.,"['• Atomicity problems. A computer system, like any other device, is subject\n to failure. In many applications, it is crucial that, if a failure occurs, the data\n\n\n-----', '• Atomicity problems. A computer system, like any other device, is subject\n to failure. In many applications, it is crucial that, if a failure occurs, the data\n\n\n-----', '**1.2** **Purpose of Database Systems** **5**\n\n###### be restored to the consistent state that existed prior to the failure. Consider a program to transfer $500 from the account balance of department A to the account balance of department B. If a system failure occurs during the execution of the program, it is possible that the $500 was removed from the balance of department A but was not credited to the balance of department B, resulting in an inconsistent database state. Clearly, it is essential to database consistency that either both the credit and debit occur, or that neither occur. That is, the funds transfer must be atomic—it must happen in its entirety or not at all. It is difficult to ensure atomicity in a conventional file-processing system.', '**1.2** **Purpose of Database Systems** **5**\n\n###### be restored to the consistent state that existed prior to the failure. Consider a program to transfer $500 from the account balance of department A to the account balance of department B. If a system failure occurs during the execution of the program, it is possible that the $500 was removed from the balance of department A but was not credited to the balance of department B, resulting in an inconsistent database state. Clearly, it is essential to database consistency that either both the credit and debit occur, or that neither occur. That is, the funds transfer must be atomic—it must happen in its entirety or not at all. It is difficult to ensure atomicity in a conventional file-processing system.', '• Data isolation. Because data are scattered in various files, and files may\n be in different formats, writing new application programs to retrieve the appropriate data is difficult.\n\n • Integrity problems. The data values stored in the database must satisfy cer tain types of consistency constraints. Suppose the university maintains an account for each department, and records the balance amount in each ac- count. Suppose also that the university requires that the account balance of a department may never fall below zero. Developers enforce these constraints in the system by adding appropriate code in the various application pro- grams. However, when new constraints are added, it is difficult to change the programs to enforce them. The problem is compounded when constraints involve several data items from different files.\n\n • Atomicity problems. A computer system, like any other device, is subject\n to failure. In many applications, it is crucial that, if a failure occurs, the data', '• Data isolation. Because data are scattered in various files, and files may\n be in different formats, writing new application programs to retrieve the appropriate data is difficult.\n\n • Integrity problems. The data values stored in the database must satisfy cer tain types of consistency constraints. Suppose the university maintains an account for each department, and records the balance amount in each ac- count. Suppose also that the university requires that the account balance of a department may never fall below zero. Developers enforce these constraints in the system by adding appropriate code in the various application pro- grams. However, when new constraints are added, it is difficult to change the programs to enforce them. The problem is compounded when constraints involve several data items from different files.\n\n • Atomicity problems. A computer system, like any other device, is subject\n to failure. In many applications, it is crucial that, if a failure occurs, the data']","The atomicity problem in a file system refers to the challenge of ensuring that operations like fund transfers occur entirely or not at all, especially in the event of system failures. For example, if $500 is deducted from one account but not credited to another due to a failure, it leads to an inconsistent state. This issue highlights the difficulty in maintaining atomicity in conventional file-processing systems.","A computer system, like any other device, is subject to failure. In many applications, it is crucial that, if a failure occurs, the data be restored to the consistent state that existed prior to the failure. But usual file system doesn't guarantee this atomcity.",0.907950695828461,0.8766666666491333,0.75,0.6666666666666666,0.6447626485695859
7,how database system hides certain details of how data are stored?,"['**6** **Chapter 1** **Introduction**\n\n###### These difficulties, among others, prompted the development of database sys tems. In what follows, we shall see the concepts and algorithms that enable database systems to solve the problems with file-processing systems. In most of this book, we use a university organization as a running example of a typical data-processing application.\n\n 1.3 View of Data\n\n A database system is a collection of interrelated data and a set of programs that allow users to access and modify these data. A major purpose of a database system is to provide users with an abstract view of the data. That is, the system hides certain details of how the data are stored and maintained.\n\n**1.3.1** **Data Abstraction**', '**6** **Chapter 1** **Introduction**\n\n###### These difficulties, among others, prompted the development of database sys tems. In what follows, we shall see the concepts and algorithms that enable database systems to solve the problems with file-processing systems. In most of this book, we use a university organization as a running example of a typical data-processing application.\n\n 1.3 View of Data\n\n A database system is a collection of interrelated data and a set of programs that allow users to access and modify these data. A major purpose of a database system is to provide users with an abstract view of the data. That is, the system hides certain details of how the data are stored and maintained.\n\n**1.3.1** **Data Abstraction**', '**1.2** **Purpose of Database Systems** **3**\n\n###### tion about you may be retrieved from a database to select which advertisements you should see. Furthermore, data about your Web accesses may be stored in a database.\n Thus, although user interfaces hide details of access to a database, and most\n people are not even aware they are dealing with a database, accessing databases forms an essential part of almost everyone’s life today.\n The importance of database systems can be judged in another way—today,\n database system vendors like Oracle are among the largest software companies in the world, and database systems form an important part of the product line of Microsoft and IBM.\n\n 1.2 Purpose of Database Systems', '• Security problems. Not every user of the database system should be able\n to access all the data. For example, in a university, payroll personnel need to see only that part of the database that has financial information. They do not need access to information about academic records. But, since applica- tion programs are added to the file-processing system in an ad hoc manner, enforcing such security constraints is difficult.\n\n\n-----', '• Security problems. Not every user of the database system should be able\n to access all the data. For example, in a university, payroll personnel need to see only that part of the database that has financial information. They do not need access to information about academic records. But, since applica- tion programs are added to the file-processing system in an ad hoc manner, enforcing such security constraints is difficult.\n\n\n-----', '**1.2** **Purpose of Database Systems** **3**\n\n###### tion about you may be retrieved from a database to select which advertisements you should see. Furthermore, data about your Web accesses may be stored in a database.\n Thus, although user interfaces hide details of access to a database, and most\n people are not even aware they are dealing with a database, accessing databases forms an essential part of almost everyone’s life today.\n The importance of database systems can be judged in another way—today,\n database system vendors like Oracle are among the largest software companies in the world, and database systems form an important part of the product line of Microsoft and IBM.\n\n 1.2 Purpose of Database Systems']","A database system hides certain details of how data are stored through data abstraction, providing users with an abstract view of the data. This abstraction allows users to access and modify data without needing to know the underlying storage mechanisms. By abstracting the storage details, users can interact with the data in a more user-friendly and efficient manner.",Database system provides users with an abstract view of the data.,0.8857352029975458,0.9999999999833333,1.0,1.0,0.4010582536379852
8,Please briefly introduce the 3 levels of data abstraction.,"['• View level. The highest level of abstraction describes only part of the entire\n database. Even though the logical level uses simpler structures, complexity remains because of the variety of information stored in a large database. Many users of the database system do not need all this information; instead, they need to access only a part of the database. The view level of abstraction exists to simplify their interaction with the system. The system may provide many views for the same database.\n\n Figure 1.1 shows the relationship among the three levels of abstraction.\n An analogy to the concept of data types in programming languages may\n clarify the distinction among levels of abstraction. Many high-level programming\n\n\n-----', '• View level. The highest level of abstraction describes only part of the entire\n database. Even though the logical level uses simpler structures, complexity remains because of the variety of information stored in a large database. Many users of the database system do not need all this information; instead, they need to access only a part of the database. The view level of abstraction exists to simplify their interaction with the system. The system may provide many views for the same database.\n\n Figure 1.1 shows the relationship among the three levels of abstraction.\n An analogy to the concept of data types in programming languages may\n clarify the distinction among levels of abstraction. Many high-level programming\n\n\n-----', '• Physical level. The lowest level of abstraction describes how the data are ac tually stored. The physical level describes complex low-level data structures in detail.\n\n • Logical level. The next-higher level of abstraction describes what data are\n stored in the database, and what relationships exist among those data. The logical level thus describes the entire database in terms of a small number of relatively simple structures. Although implementation of the simple struc- tures at the logical level may involve complex physical-level structures, the user of the logical level does not need to be aware of this complexity. This is referred to as physical data independence. Database administrators, who must decide what information to keep in the database, use the logical level of abstraction.', '• Physical level. The lowest level of abstraction describes how the data are ac tually stored. The physical level describes complex low-level data structures in detail.\n\n • Logical level. The next-higher level of abstraction describes what data are\n stored in the database, and what relationships exist among those data. The logical level thus describes the entire database in terms of a small number of relatively simple structures. Although implementation of the simple struc- tures at the logical level may involve complex physical-level structures, the user of the logical level does not need to be aware of this complexity. This is referred to as physical data independence. Database administrators, who must decide what information to keep in the database, use the logical level of abstraction.', '**1.3.1** **Data Abstraction**\n\n###### For the system to be usable, it must retrieve data efficiently. The need for efficiency has led designers to use complex data structures to represent data in the database. Since many database-system users are not computer trained, developers hide the complexity from users through several levels of abstraction, to simplify users’ interactions with the system:\n\n • Physical level. The lowest level of abstraction describes how the data are ac tually stored. The physical level describes complex low-level data structures in detail.', '**1.3.1** **Data Abstraction**\n\n###### For the system to be usable, it must retrieve data efficiently. The need for efficiency has led designers to use complex data structures to represent data in the database. Since many database-system users are not computer trained, developers hide the complexity from users through several levels of abstraction, to simplify users’ interactions with the system:\n\n • Physical level. The lowest level of abstraction describes how the data are ac tually stored. The physical level describes complex low-level data structures in detail.']","The three levels of data abstraction are the physical level, logical level, and view level. The physical level describes how data are actually stored, including complex low-level data structures. The logical level describes what data is stored and the relationships among them, simplifying the database into simple structures. The view level provides users with a simplified view of the database, allowing them to interact with specific parts of the data without needing to understand the entire database structure.","Database system hides the complexity from users through several levels of abstraction, to simplify users' interactions with the system. This abstraction hierarchy consists of physical level, logical level, and view level.",0.9684438799564871,0.9999999999833333,1.0,1.0,0.7907030621752639
9,What is the characteristic of logical level in data abstraction?,"['• Physical level. The lowest level of abstraction describes how the data are ac tually stored. The physical level describes complex low-level data structures in detail.\n\n • Logical level. The next-higher level of abstraction describes what data are\n stored in the database, and what relationships exist among those data. The logical level thus describes the entire database in terms of a small number of relatively simple structures. Although implementation of the simple struc- tures at the logical level may involve complex physical-level structures, the user of the logical level does not need to be aware of this complexity. This is referred to as physical data independence. Database administrators, who must decide what information to keep in the database, use the logical level of abstraction.', '• Physical level. The lowest level of abstraction describes how the data are ac tually stored. The physical level describes complex low-level data structures in detail.\n\n • Logical level. The next-higher level of abstraction describes what data are\n stored in the database, and what relationships exist among those data. The logical level thus describes the entire database in terms of a small number of relatively simple structures. Although implementation of the simple struc- tures at the logical level may involve complex physical-level structures, the user of the logical level does not need to be aware of this complexity. This is referred to as physical data independence. Database administrators, who must decide what information to keep in the database, use the logical level of abstraction.', '• View level. The highest level of abstraction describes only part of the entire\n database. Even though the logical level uses simpler structures, complexity remains because of the variety of information stored in a large database. Many users of the database system do not need all this information; instead, they need to access only a part of the database. The view level of abstraction exists to simplify their interaction with the system. The system may provide many views for the same database.\n\n Figure 1.1 shows the relationship among the three levels of abstraction.\n An analogy to the concept of data types in programming languages may\n clarify the distinction among levels of abstraction. Many high-level programming\n\n\n-----', '• View level. The highest level of abstraction describes only part of the entire\n database. Even though the logical level uses simpler structures, complexity remains because of the variety of information stored in a large database. Many users of the database system do not need all this information; instead, they need to access only a part of the database. The view level of abstraction exists to simplify their interaction with the system. The system may provide many views for the same database.\n\n Figure 1.1 shows the relationship among the three levels of abstraction.\n An analogy to the concept of data types in programming languages may\n clarify the distinction among levels of abstraction. Many high-level programming\n\n\n-----', '**1.3.1** **Data Abstraction**\n\n###### For the system to be usable, it must retrieve data efficiently. The need for efficiency has led designers to use complex data structures to represent data in the database. Since many database-system users are not computer trained, developers hide the complexity from users through several levels of abstraction, to simplify users’ interactions with the system:\n\n • Physical level. The lowest level of abstraction describes how the data are ac tually stored. The physical level describes complex low-level data structures in detail.', '**1.3.1** **Data Abstraction**\n\n###### For the system to be usable, it must retrieve data efficiently. The need for efficiency has led designers to use complex data structures to represent data in the database. Since many database-system users are not computer trained, developers hide the complexity from users through several levels of abstraction, to simplify users’ interactions with the system:\n\n • Physical level. The lowest level of abstraction describes how the data are ac tually stored. The physical level describes complex low-level data structures in detail.']","The logical level in data abstraction describes what data is stored in the database and the relationships among them. It simplifies the database into a small number of relatively simple structures. Users interacting at the logical level do not need to be aware of the complex physical-level structures, known as physical data independence.","Logical level describes what data are stored in the database, and what relationships exist among those data. The logical level thus describes the entire database in terms of a small number of relatively simple structures. Although implementation of the simple structures at the logical level may involve complex physical-level structures, the user of the logical level does not need to be aware of this complexity. This is referred to as physical data independence.",0.9592033381754553,0.9999999999833333,1.0,1.0,0.7090677744512878
10,What is the other name for several schemas at the view level?,"['Database systems have several schemas, partitioned according to the levels\n of abstraction. The physical schema describes the database design at the physical level, while the logical schema describes the database design at the logical level. A database may also have several schemas at the view level, sometimes called subschemas, that describe different views of the database.\n Of these, the logical schema is by far the most important, in terms of its effect\n on application programs, since programmers construct applications by using the logical schema. The physical schemaishiddenbeneaththe logical schema, and can usually be changed easily without affecting application programs. Application programs are said to exhibit physical data independence if they do not depend on the physical schema, and thus need not be rewritten if the physical schema changes.\n We study languages for describing schemas after introducing the notion of\n data models in the next section.', 'Database systems have several schemas, partitioned according to the levels\n of abstraction. The physical schema describes the database design at the physical level, while the logical schema describes the database design at the logical level. A database may also have several schemas at the view level, sometimes called subschemas, that describe different views of the database.\n Of these, the logical schema is by far the most important, in terms of its effect\n on application programs, since programmers construct applications by using the logical schema. The physical schemaishiddenbeneaththe logical schema, and can usually be changed easily without affecting application programs. Application programs are said to exhibit physical data independence if they do not depend on the physical schema, and thus need not be rewritten if the physical schema changes.\n We study languages for describing schemas after introducing the notion of\n data models in the next section.', '**1.3.2** **Instances and Schemas**', '**1.3.2** **Instances and Schemas**', '• View level. The highest level of abstraction describes only part of the entire\n database. Even though the logical level uses simpler structures, complexity remains because of the variety of information stored in a large database. Many users of the database system do not need all this information; instead, they need to access only a part of the database. The view level of abstraction exists to simplify their interaction with the system. The system may provide many views for the same database.\n\n Figure 1.1 shows the relationship among the three levels of abstraction.\n An analogy to the concept of data types in programming languages may\n clarify the distinction among levels of abstraction. Many high-level programming\n\n\n-----', '• View level. The highest level of abstraction describes only part of the entire\n database. Even though the logical level uses simpler structures, complexity remains because of the variety of information stored in a large database. Many users of the database system do not need all this information; instead, they need to access only a part of the database. The view level of abstraction exists to simplify their interaction with the system. The system may provide many views for the same database.\n\n Figure 1.1 shows the relationship among the three levels of abstraction.\n An analogy to the concept of data types in programming languages may\n clarify the distinction among levels of abstraction. Many high-level programming\n\n\n-----']",Subschemas are another name for several schemas at the view level in a database system.,We can call schemas at the view level as 'subschemas' instead.,0.8724000516522433,0.81666666664625,1.0,1.0,0.9761280485769626
11,What is physical data indenpendence?,"['• Physical level. The lowest level of abstraction describes how the data are ac tually stored. The physical level describes complex low-level data structures in detail.\n\n • Logical level. The next-higher level of abstraction describes what data are\n stored in the database, and what relationships exist among those data. The logical level thus describes the entire database in terms of a small number of relatively simple structures. Although implementation of the simple struc- tures at the logical level may involve complex physical-level structures, the user of the logical level does not need to be aware of this complexity. This is referred to as physical data independence. Database administrators, who must decide what information to keep in the database, use the logical level of abstraction.', '• Physical level. The lowest level of abstraction describes how the data are ac tually stored. The physical level describes complex low-level data structures in detail.\n\n • Logical level. The next-higher level of abstraction describes what data are\n stored in the database, and what relationships exist among those data. The logical level thus describes the entire database in terms of a small number of relatively simple structures. Although implementation of the simple struc- tures at the logical level may involve complex physical-level structures, the user of the logical level does not need to be aware of this complexity. This is referred to as physical data independence. Database administrators, who must decide what information to keep in the database, use the logical level of abstraction.', '**4** **Chapter 1** **Introduction**\n\n###### • Data redundancy and inconsistency. Since different programmers create\n the files and application programs over a long period, the various files are likely to have different structures and the programs may be written in several programming languages. Moreover, the same information may be duplicated in several places (files). For example, if a student has a double major (say, music and mathematics) the address and telephone number of that student may appear in a file that consists of student records of students in the Music department and in a file that consists of student records of students in the Mathematics department. This redundancy leads to higher storage and access cost. In addition, it may lead to data inconsistency; that is, the various copies of the same data may no longer agree. For example, a changed student address may be reflected in the Music department records but not elsewhere in the system.', '**4** **Chapter 1** **Introduction**\n\n###### • Data redundancy and inconsistency. Since different programmers create\n the files and application programs over a long period, the various files are likely to have different structures and the programs may be written in several programming languages. Moreover, the same information may be duplicated in several places (files). For example, if a student has a double major (say, music and mathematics) the address and telephone number of that student may appear in a file that consists of student records of students in the Music department and in a file that consists of student records of students in the Mathematics department. This redundancy leads to higher storage and access cost. In addition, it may lead to data inconsistency; that is, the various copies of the same data may no longer agree. For example, a changed student address may be reflected in the Music department records but not elsewhere in the system.', '**1.3.1** **Data Abstraction**\n\n###### For the system to be usable, it must retrieve data efficiently. The need for efficiency has led designers to use complex data structures to represent data in the database. Since many database-system users are not computer trained, developers hide the complexity from users through several levels of abstraction, to simplify users’ interactions with the system:\n\n • Physical level. The lowest level of abstraction describes how the data are ac tually stored. The physical level describes complex low-level data structures in detail.', '**1.3.1** **Data Abstraction**\n\n###### For the system to be usable, it must retrieve data efficiently. The need for efficiency has led designers to use complex data structures to represent data in the database. Since many database-system users are not computer trained, developers hide the complexity from users through several levels of abstraction, to simplify users’ interactions with the system:\n\n • Physical level. The lowest level of abstraction describes how the data are ac tually stored. The physical level describes complex low-level data structures in detail.']",Physical data independence refers to the concept that users interacting at the logical level do not need to be aware of the complex physical-level structures in the database. It allows changes to the physical storage structures to occur without affecting the application programs at the logical level. This separation between the physical and logical levels simplifies database management and maintenance.,"e physical schema is hidden beneath the logical schema, and can usually be changed easily without affecting application programs.",0.9686376187410374,0.8766666666491333,0.3333333333333333,0.0,0.7116079250019014
12,What is the differences between procedural DMLs and Declarative DMLs?,"['• Declarative DMLs (also referred to as nonprocedural DMLs) require a user to\n specify what data are needed without specifying how to get those data.\n\n Declarative DMLs are usually easier to learn and use than are procedural', '• Declarative DMLs (also referred to as nonprocedural DMLs) require a user to\n specify what data are needed without specifying how to get those data.\n\n Declarative DMLs are usually easier to learn and use than are procedural', '**10** **Chapter 1** **Introduction**\n\n###### dates. In practice, the data-definition and data-manipulation languages are not two separate languages; instead they simply form parts of a single database lan- guage, such as the widely used SQL language.\n\n**1.4.1** **Data-Manipulation Language**\n\n###### A data-manipulation language (DML) is a language that enables users to access or manipulate data as organized by the appropriate data model. The types of access are:\n\n • Retrieval of information stored in the database\n • Insertion of new information into the database\n • Deletion of information from the database\n • Modification of information stored in the database\n\n There are basically two types:\n\n • Procedural DMLs require a user to specify what data are needed and how to\n get those data.\n\n • Declarative DMLs (also referred to as nonprocedural DMLs) require a user to\n specify what data are needed without specifying how to get those data.', '**10** **Chapter 1** **Introduction**\n\n###### dates. In practice, the data-definition and data-manipulation languages are not two separate languages; instead they simply form parts of a single database lan- guage, such as the widely used SQL language.\n\n**1.4.1** **Data-Manipulation Language**\n\n###### A data-manipulation language (DML) is a language that enables users to access or manipulate data as organized by the appropriate data model. The types of access are:\n\n • Retrieval of information stored in the database\n • Insertion of new information into the database\n • Deletion of information from the database\n • Modification of information stored in the database\n\n There are basically two types:\n\n • Procedural DMLs require a user to specify what data are needed and how to\n get those data.\n\n • Declarative DMLs (also referred to as nonprocedural DMLs) require a user to\n specify what data are needed without specifying how to get those data.', 'DMLs. However, since a user does not have to specify how to get the data, the\n###### database system has to figure out an efficient means of accessing data.\n A query is a statement requesting the retrieval of information. The portion of\n a DML that involves information retrieval is called a query language. Although technically incorrect, it is common practice to use the terms query language and data-manipulation language synonymously.\n There are a number of database query languages in use, either commercially\n or experimentally. We study the most widely used query language, SQL, in Chap- ters 3, 4, and 5. We also study some other query languages in Chapter 6.\n The levels of abstraction that we discussed in Section 1.3 apply not only', 'DMLs. However, since a user does not have to specify how to get the data, the\n###### database system has to figure out an efficient means of accessing data.\n A query is a statement requesting the retrieval of information. The portion of\n a DML that involves information retrieval is called a query language. Although technically incorrect, it is common practice to use the terms query language and data-manipulation language synonymously.\n There are a number of database query languages in use, either commercially\n or experimentally. We study the most widely used query language, SQL, in Chap- ters 3, 4, and 5. We also study some other query languages in Chapter 6.\n The levels of abstraction that we discussed in Section 1.3 apply not only']","Procedural DMLs require users to specify both what data is needed and how to retrieve it, while declarative DMLs only require users to specify what data is needed without detailing how to retrieve it. Declarative DMLs are generally easier to learn and use compared to procedural DMLs. Both types of DMLs are part of a single database language, such as SQL.",Procedural DMLs require a user to specify what data are needed and how to get those data. But Declarative DMLs (also referred to as nonprocedural DMLs) require a user to specify what data are needed without specifying how to get those data.,0.937036353982536,0.9999999999833333,1.0,1.0,0.5428882614016379
13,"As we can see in the 'department' table, What is the dept_name that belongs to 'Taylor' building?","['**1.6** **Database Design** **19**\n\n_ID_ _name_ _salary_ _dept name_ _building_ _budget_\n\n###### 22222 Einstein 95000 Physics Watson 70000\n 12121 Wu 90000 Finance Painter 120000\n 32343 El Said 60000 History Painter 50000\n 45565 Katz 75000 Comp. Sci. Taylor 100000\n 98345 Kim 80000 Elec. Eng. Taylor 85000\n 76766 Crick 72000 Biology Watson 90000\n 10101 Srinivasan 65000 Comp. Sci. Taylor 100000\n 58583 Califieri 62000 History Painter 50000\n 83821 Brandt 92000 Comp. Sci. Taylor 100000\n 15151 Mozart 40000 Music Packard 80000\n 33456 Gold 87000 Physics Watson 70000\n 76543 Singh 80000 Finance Painter 120000\n\n**Figure 1.4** The faculty table.', '**1.6** **Database Design** **19**\n\n_ID_ _name_ _salary_ _dept name_ _building_ _budget_\n\n###### 22222 Einstein 95000 Physics Watson 70000\n 12121 Wu 90000 Finance Painter 120000\n 32343 El Said 60000 History Painter 50000\n 45565 Katz 75000 Comp. Sci. Taylor 100000\n 98345 Kim 80000 Elec. Eng. Taylor 85000\n 76766 Crick 72000 Biology Watson 90000\n 10101 Srinivasan 65000 Comp. Sci. Taylor 100000\n 58583 Califieri 62000 History Painter 50000\n 83821 Brandt 92000 Comp. Sci. Taylor 100000\n 15151 Mozart 40000 Music Packard 80000\n 33456 Gold 87000 Physics Watson 70000\n 76543 Singh 80000 Finance Painter 120000\n\n**Figure 1.4** The faculty table.', '**1.5** **Relational Databases** **13**\n\n_ID_ _name_ _dept name_ _salary_\n\n###### 22222 Einstein Physics 95000\n 12121 Wu Finance 90000\n 32343 El Said History 60000\n 45565 Katz Comp. Sci. 75000\n 98345 Kim Elec. Eng. 80000\n 76766 Crick Biology 72000\n 10101 Srinivasan Comp. Sci. 65000\n 58583 Califieri History 62000\n 83821 Brandt Comp. Sci. 92000\n 15151 Mozart Music 40000\n 33456 Gold Physics 87000\n 76543 Singh Finance 80000\n\n (a) The instructor table\n\n dept name building budget\n\n Comp. Sci. Taylor 100000\n Biology Watson 90000\n Elec. Eng. Taylor 85000\n Music Packard 80000\n Finance Painter 120000\n History Painter 50000\n Physics Watson 70000\n\n (b) The department table\n\n**Figure 1.2** A sample relational database.\n\n###### associated with the Physics department. In Chapter 8, we shall study how to distinguish good schema designs from bad schema designs.\n\n**1.5.2** **Data-Manipulation Language**', '**1.5** **Relational Databases** **13**\n\n_ID_ _name_ _dept name_ _salary_\n\n###### 22222 Einstein Physics 95000\n 12121 Wu Finance 90000\n 32343 El Said History 60000\n 45565 Katz Comp. Sci. 75000\n 98345 Kim Elec. Eng. 80000\n 76766 Crick Biology 72000\n 10101 Srinivasan Comp. Sci. 65000\n 58583 Califieri History 62000\n 83821 Brandt Comp. Sci. 92000\n 15151 Mozart Music 40000\n 33456 Gold Physics 87000\n 76543 Singh Finance 80000\n\n (a) The instructor table\n\n dept name building budget\n\n Comp. Sci. Taylor 100000\n Biology Watson 90000\n Elec. Eng. Taylor 85000\n Music Packard 80000\n Finance Painter 120000\n History Painter 50000\n Physics Watson 70000\n\n (b) The department table\n\n**Figure 1.2** A sample relational database.\n\n###### associated with the Physics department. In Chapter 8, we shall study how to distinguish good schema designs from bad schema designs.\n\n**1.5.2** **Data-Manipulation Language**', '**14** **Chapter 1** **Introduction**\n\n###### labeled name, and a set of rows, each of which contains the name of an instructor whose dept name, is History. If the query is run on the table in Figure 1.2, the result will consist of two rows, one with the name El Said and the other with the name Califieri.\n Queries may involve information from more than one table. For instance, the\n following query finds the instructor ID and department name of all instructors associated with a department with budget of greater than $95,000.\n\n select instructor.ID, department.dept name from instructor, department where instructor.dept name department.dept name and =\n department.budget > 95000;', '**14** **Chapter 1** **Introduction**\n\n###### labeled name, and a set of rows, each of which contains the name of an instructor whose dept name, is History. If the query is run on the table in Figure 1.2, the result will consist of two rows, one with the name El Said and the other with the name Califieri.\n Queries may involve information from more than one table. For instance, the\n following query finds the instructor ID and department name of all instructors associated with a department with budget of greater than $95,000.\n\n select instructor.ID, department.dept name from instructor, department where instructor.dept name department.dept name and =\n department.budget > 95000;']",The dept_name that belongs to the 'Taylor' building in the department table is 'Comp. Sci.',Comp. Sci department and Elec. Eng. department belongs to the building named 'Taylor'.,0.9553609898123767,0.999999999975,,1.0,0.22998966431474693
14,"As we can see the 'instructor' table, How many professor data are stored in the instructor table?","['**14** **Chapter 1** **Introduction**\n\n###### labeled name, and a set of rows, each of which contains the name of an instructor whose dept name, is History. If the query is run on the table in Figure 1.2, the result will consist of two rows, one with the name El Said and the other with the name Califieri.\n Queries may involve information from more than one table. For instance, the\n following query finds the instructor ID and department name of all instructors associated with a department with budget of greater than $95,000.\n\n select instructor.ID, department.dept name from instructor, department where instructor.dept name department.dept name and =\n department.budget > 95000;', '**14** **Chapter 1** **Introduction**\n\n###### labeled name, and a set of rows, each of which contains the name of an instructor whose dept name, is History. If the query is run on the table in Figure 1.2, the result will consist of two rows, one with the name El Said and the other with the name Califieri.\n Queries may involve information from more than one table. For instance, the\n following query finds the instructor ID and department name of all instructors associated with a department with budget of greater than $95,000.\n\n select instructor.ID, department.dept name from instructor, department where instructor.dept name department.dept name and =\n department.budget > 95000;', 'select instructor.ID, department.dept name from instructor, department where instructor.dept name department.dept name and =\n department.budget > 95000;\n\n If the above query were run on the tables in Figure 1.2, the system would find that there are two departments with budget of greater than $95,000—Computer Science and Finance; there are five instructors in these departments. Thus, the result will consist of a table with two columns (ID, dept name) and five rows: (12121, Finance), (45565, Computer Science), (10101, Computer Science), (83821, Computer Science), and (76543, Finance).\n\n**1.5.3** **Data-Definition Language**\n\nSQL provides a rich DDL that allows one to define tables, integrity constraints,\n###### assertions, etc.\n For instance, the following SQL DDL statement defines the department table:\n\n create table department\n (dept name char (20),\n building char (15),\n budget numeric (12,2));', '**1.6** **Database Design** **19**\n\n_ID_ _name_ _salary_ _dept name_ _building_ _budget_\n\n###### 22222 Einstein 95000 Physics Watson 70000\n 12121 Wu 90000 Finance Painter 120000\n 32343 El Said 60000 History Painter 50000\n 45565 Katz 75000 Comp. Sci. Taylor 100000\n 98345 Kim 80000 Elec. Eng. Taylor 85000\n 76766 Crick 72000 Biology Watson 90000\n 10101 Srinivasan 65000 Comp. Sci. Taylor 100000\n 58583 Califieri 62000 History Painter 50000\n 83821 Brandt 92000 Comp. Sci. Taylor 100000\n 15151 Mozart 40000 Music Packard 80000\n 33456 Gold 87000 Physics Watson 70000\n 76543 Singh 80000 Finance Painter 120000\n\n**Figure 1.4** The faculty table.', '**1.6** **Database Design** **19**\n\n_ID_ _name_ _salary_ _dept name_ _building_ _budget_\n\n###### 22222 Einstein 95000 Physics Watson 70000\n 12121 Wu 90000 Finance Painter 120000\n 32343 El Said 60000 History Painter 50000\n 45565 Katz 75000 Comp. Sci. Taylor 100000\n 98345 Kim 80000 Elec. Eng. Taylor 85000\n 76766 Crick 72000 Biology Watson 90000\n 10101 Srinivasan 65000 Comp. Sci. Taylor 100000\n 58583 Califieri 62000 History Painter 50000\n 83821 Brandt 92000 Comp. Sci. Taylor 100000\n 15151 Mozart 40000 Music Packard 80000\n 33456 Gold 87000 Physics Watson 70000\n 76543 Singh 80000 Finance Painter 120000\n\n**Figure 1.4** The faculty table.', 'select instructor.ID, department.dept name from instructor, department where instructor.dept name department.dept name and =\n department.budget > 95000;\n\n If the above query were run on the tables in Figure 1.2, the system would find that there are two departments with budget of greater than $95,000—Computer Science and Finance; there are five instructors in these departments. Thus, the result will consist of a table with two columns (ID, dept name) and five rows: (12121, Finance), (45565, Computer Science), (10101, Computer Science), (83821, Computer Science), and (76543, Finance).\n\n**1.5.3** **Data-Definition Language**\n\nSQL provides a rich DDL that allows one to define tables, integrity constraints,\n###### assertions, etc.\n For instance, the following SQL DDL statement defines the department table:\n\n create table department\n (dept name char (20),\n building char (15),\n budget numeric (12,2));']",There are a total of 11 professor data stored in the instructor table.,The information of 12 professors is stored in the instructor table.,0.9575473462854699,0.4499999999775,0.0,0.0,0.23993801819183902
15,"In the department table, which dept_name is with budget over 90000?","['**14** **Chapter 1** **Introduction**\n\n###### labeled name, and a set of rows, each of which contains the name of an instructor whose dept name, is History. If the query is run on the table in Figure 1.2, the result will consist of two rows, one with the name El Said and the other with the name Califieri.\n Queries may involve information from more than one table. For instance, the\n following query finds the instructor ID and department name of all instructors associated with a department with budget of greater than $95,000.\n\n select instructor.ID, department.dept name from instructor, department where instructor.dept name department.dept name and =\n department.budget > 95000;', '**14** **Chapter 1** **Introduction**\n\n###### labeled name, and a set of rows, each of which contains the name of an instructor whose dept name, is History. If the query is run on the table in Figure 1.2, the result will consist of two rows, one with the name El Said and the other with the name Califieri.\n Queries may involve information from more than one table. For instance, the\n following query finds the instructor ID and department name of all instructors associated with a department with budget of greater than $95,000.\n\n select instructor.ID, department.dept name from instructor, department where instructor.dept name department.dept name and =\n department.budget > 95000;', '**1.6** **Database Design** **19**\n\n_ID_ _name_ _salary_ _dept name_ _building_ _budget_\n\n###### 22222 Einstein 95000 Physics Watson 70000\n 12121 Wu 90000 Finance Painter 120000\n 32343 El Said 60000 History Painter 50000\n 45565 Katz 75000 Comp. Sci. Taylor 100000\n 98345 Kim 80000 Elec. Eng. Taylor 85000\n 76766 Crick 72000 Biology Watson 90000\n 10101 Srinivasan 65000 Comp. Sci. Taylor 100000\n 58583 Califieri 62000 History Painter 50000\n 83821 Brandt 92000 Comp. Sci. Taylor 100000\n 15151 Mozart 40000 Music Packard 80000\n 33456 Gold 87000 Physics Watson 70000\n 76543 Singh 80000 Finance Painter 120000\n\n**Figure 1.4** The faculty table.', '**1.6** **Database Design** **19**\n\n_ID_ _name_ _salary_ _dept name_ _building_ _budget_\n\n###### 22222 Einstein 95000 Physics Watson 70000\n 12121 Wu 90000 Finance Painter 120000\n 32343 El Said 60000 History Painter 50000\n 45565 Katz 75000 Comp. Sci. Taylor 100000\n 98345 Kim 80000 Elec. Eng. Taylor 85000\n 76766 Crick 72000 Biology Watson 90000\n 10101 Srinivasan 65000 Comp. Sci. Taylor 100000\n 58583 Califieri 62000 History Painter 50000\n 83821 Brandt 92000 Comp. Sci. Taylor 100000\n 15151 Mozart 40000 Music Packard 80000\n 33456 Gold 87000 Physics Watson 70000\n 76543 Singh 80000 Finance Painter 120000\n\n**Figure 1.4** The faculty table.', '###### dept name\n\n\n###### dept name\n\n\n###### building\n\n\n###### budget\n\n\n_ID_\n\n\n_ID_\n\n\n-----', '###### dept name\n\n\n###### dept name\n\n\n###### building\n\n\n###### budget\n\n\n_ID_\n\n\n_ID_\n\n\n-----']","The department with the dept_name 'Finance' has a budget over $90,000 in the department table.",3 dept_name have more than 9000 budget.,0.9109160980251478,0.4166666666458333,0.0,0.0,0.21924290741591088
