,user_input,retrieved_contexts,response,reference,answer_relevancy,context_precision,faithfulness,context_recall,answer_correctness
0,Who invented SQL standard when?,"['ft h eSystem R project in the early 1970s. The Sequel language has evolved since then,and its name has changed toSQL(Structured Query Language). Many productsnow support theSQLlanguage.SQLhas clearly established itself asthestandardrelational database language.In 1986, the American National Standards Institute (ANSI)a n dt h eI n t e r n a -tional Organization for Standardization (ISO)p u b l i s h e da nSQLstandard, calledSQL-86.ANSIpublished an extended standard forSQL,SQL-89,i n1 9 8 9 .T h en e x tv e r -sion of the standard wasSQL-92standard, followed bySQL:1999,SQL:2003,SQL:2006,and most recentlySQL:2008. The bibliographic notes provide references to thesestandards.TheSQLlanguage has several parts:•Data-deﬁnition language(DDL). TheSQL DDLprovides commands for deﬁn-ing relation schemas, deleting relations, and modifying relation schemas.•Data-manipulation language(DML). TheSQL DMLprovides the ability toquery information from the database and to insert tuples into, delete', 'ft h eSystem R project in the early 1970s. The Sequel language has evolved since then,and its name has changed toSQL(Structured Query Language). Many productsnow support theSQLlanguage.SQLhas clearly established itself asthestandardrelational database language.In 1986, the American National Standards Institute (ANSI)a n dt h eI n t e r n a -tional Organization for Standardization (ISO)p u b l i s h e da nSQLstandard, calledSQL-86.ANSIpublished an extended standard forSQL,SQL-89,i n1 9 8 9 .T h en e x tv e r -sion of the standard wasSQL-92standard, followed bySQL:1999,SQL:2003,SQL:2006,and most recentlySQL:2008. The bibliographic notes provide references to thesestandards.TheSQLlanguage has several parts:•Data-deﬁnition language(DDL). TheSQL DDLprovides commands for deﬁn-ing relation schemas, deleting relations, and modifying relation schemas.•Data-manipulation language(DML). TheSQL DMLprovides the ability toquery information from the database and to insert tuples into, delete', 'ft h eSystem R project in the early 1970s. The Sequel language has evolved since then,and its name has changed toSQL(Structured Query Language). Many productsnow support theSQLlanguage.SQLhas clearly established itself asthestandardrelational database language.In 1986, the American National Standards Institute (ANSI)a n dt h eI n t e r n a -tional Organization for Standardization (ISO)p u b l i s h e da nSQLstandard, calledSQL-86.ANSIpublished an extended standard forSQL,SQL-89,i n1 9 8 9 .T h en e x tv e r -sion of the standard wasSQL-92standard, followed bySQL:1999,SQL:2003,SQL:2006,and most recentlySQL:2008. The bibliographic notes provide references to thesestandards.TheSQLlanguage has several parts:•Data-deﬁnition language(DDL). TheSQL DDLprovides commands for deﬁn-ing relation schemas, deleting relations, and modifying relation schemas.•Data-manipulation language(DML). TheSQL DMLprovides the ability toquery information from the database and to insert tuples into, delete', 'ft h eSystem R project in the early 1970s. The Sequel language has evolved since then,and its name has changed toSQL(Structured Query Language). Many productsnow support theSQLlanguage.SQLhas clearly established itself asthestandardrelational database language.In 1986, the American National Standards Institute (ANSI)a n dt h eI n t e r n a -tional Organization for Standardization (ISO)p u b l i s h e da nSQLstandard, calledSQL-86.ANSIpublished an extended standard forSQL,SQL-89,i n1 9 8 9 .T h en e x tv e r -sion of the standard wasSQL-92standard, followed bySQL:1999,SQL:2003,SQL:2006,and most recentlySQL:2008. The bibliographic notes provide references to thesestandards.TheSQLlanguage has several parts:•Data-deﬁnition language(DDL). TheSQL DDLprovides commands for deﬁn-ing relation schemas, deleting relations, and modifying relation schemas.•Data-manipulation language(DML). TheSQL DMLprovides the ability toquery information from the database and to insert tuples into, delete', 'ft h eSystem R project in the early 1970s. The Sequel language has evolved since then,and its name has changed toSQL(Structured Query Language). Many productsnow support theSQLlanguage.SQLhas clearly established itself asthestandardrelational database language.In 1986, the American National Standards Institute (ANSI)a n dt h eI n t e r n a -tional Organization for Standardization (ISO)p u b l i s h e da nSQLstandard, calledSQL-86.ANSIpublished an extended standard forSQL,SQL-89,i n1 9 8 9 .T h en e x tv e r -sion of the standard wasSQL-92standard, followed bySQL:1999,SQL:2003,SQL:2006,and most recentlySQL:2008. The bibliographic notes provide references to thesestandards.TheSQLlanguage has several parts:•Data-deﬁnition language(DDL). TheSQL DDLprovides commands for deﬁn-ing relation schemas, deleting relations, and modifying relation schemas.•Data-manipulation language(DML). TheSQL DMLprovides the ability toquery information from the database and to insert tuples into, delete', '112Chapter 3Introduction to SQLinstructions on how to set up and access some popular database systems. TheSQLconstructs discussed in this chapter are part of theSQLstandard, but certainfeatures are not supported by some databases. The Web site lists these incom-patibilities, which you will need to takeinto account when executing queries onthose databases.Bibliographical NotesThe original version ofSQL,c a l l e dS e q u e l2 ,i sd e s c r i b e db yC h a m b e r l i ne ta l .[1976]. Sequel 2 was derived from the language Square (Boyce et al. [1975] andChamberlin and Boyce [1974]). The American National StandardSQL-86is de-scribed in ANSI [1986]. TheIBMSystems Application Architecture deﬁnition ofSQLis deﬁned by IBM [1987]. The ofﬁcial standards forSQL-89andSQL-92areavailable as ANSI [1989] and ANSI [1992], respectively.Textbook descriptions of theSQL-92language include Date and Darwen [1997],Melton and Simon [1993], and Cannan and Otten [1993]. Date and Darwen [1997]and Date [1993a]']","The SQL standard was first published by the American National Standards Institute (ANSI) and the International Organization for Standardization (ISO) in 1986, known as SQL-86.","In 1986, the American National Standards Institute (ANSI) and the International Organization for Standardization (ISO) published an SQL standard, called SQL-86",0.9160385618059288,0.9999999999833333,1.0,1.0,0.24141758675601338
1,How data integrity can be implemented in SQL language?,"['58Chapter 3Introduction to SQL•Integrity.T h eSQL DDLincludes commands for specifying integrity con-straints that the data stored in the database must satisfy. Updates that violateintegrity constraints are disallowed.•View deﬁnition.T h eSQL DDLincludes commands for deﬁning views.•Transaction control.SQLincludes commands for specifying the beginningand ending of transactions.•EmbeddedSQLanddynamicSQL.E m b e d d e da n dd y n a m i cSQLdeﬁne howSQLstatements can be embedded within general-purpose programming lan-guages, such as C, C++, and Java.•Authorization.T h eSQL DDLincludes commands for specifying access rightsto relations and views.In this chapter, we present a survey of basicDMLand theDDLfeatures ofSQL.Features described here have been part of theSQLstandard sinceSQL-92.In Chapter 4, we provide a more detailed coverage of theSQLquery language,including (a) various join expressions; (b) views; (c) transactions; (d) integrityconstraints; (e) type system; and (f) authorization.In', '58Chapter 3Introduction to SQL•Integrity.T h eSQL DDLincludes commands for specifying integrity con-straints that the data stored in the database must satisfy. Updates that violateintegrity constraints are disallowed.•View deﬁnition.T h eSQL DDLincludes commands for deﬁning views.•Transaction control.SQLincludes commands for specifying the beginningand ending of transactions.•EmbeddedSQLanddynamicSQL.E m b e d d e da n dd y n a m i cSQLdeﬁne howSQLstatements can be embedded within general-purpose programming lan-guages, such as C, C++, and Java.•Authorization.T h eSQL DDLincludes commands for specifying access rightsto relations and views.In this chapter, we present a survey of basicDMLand theDDLfeatures ofSQL.Features described here have been part of theSQLstandard sinceSQL-92.In Chapter 4, we provide a more detailed coverage of theSQLquery language,including (a) various join expressions; (b) views; (c) transactions; (d) integrityconstraints; (e) type system; and (f) authorization.In', '58Chapter 3Introduction to SQL•Integrity.T h eSQL DDLincludes commands for specifying integrity con-straints that the data stored in the database must satisfy. Updates that violateintegrity constraints are disallowed.•View deﬁnition.T h eSQL DDLincludes commands for deﬁning views.•Transaction control.SQLincludes commands for specifying the beginningand ending of transactions.•EmbeddedSQLanddynamicSQL.E m b e d d e da n dd y n a m i cSQLdeﬁne howSQLstatements can be embedded within general-purpose programming lan-guages, such as C, C++, and Java.•Authorization.T h eSQL DDLincludes commands for specifying access rightsto relations and views.In this chapter, we present a survey of basicDMLand theDDLfeatures ofSQL.Features described here have been part of theSQLstandard sinceSQL-92.In Chapter 4, we provide a more detailed coverage of theSQLquery language,including (a) various join expressions; (b) views; (c) transactions; (d) integrityconstraints; (e) type system; and (f) authorization.In', '58Chapter 3Introduction to SQL•Integrity.T h eSQL DDLincludes commands for specifying integrity con-straints that the data stored in the database must satisfy. Updates that violateintegrity constraints are disallowed.•View deﬁnition.T h eSQL DDLincludes commands for deﬁning views.•Transaction control.SQLincludes commands for specifying the beginningand ending of transactions.•EmbeddedSQLanddynamicSQL.E m b e d d e da n dd y n a m i cSQLdeﬁne howSQLstatements can be embedded within general-purpose programming lan-guages, such as C, C++, and Java.•Authorization.T h eSQL DDLincludes commands for specifying access rightsto relations and views.In this chapter, we present a survey of basicDMLand theDDLfeatures ofSQL.Features described here have been part of theSQLstandard sinceSQL-92.In Chapter 4, we provide a more detailed coverage of theSQLquery language,including (a) various join expressions; (b) views; (c) transactions; (d) integrityconstraints; (e) type system; and (f) authorization.In', '58Chapter 3Introduction to SQL•Integrity.T h eSQL DDLincludes commands for specifying integrity con-straints that the data stored in the database must satisfy. Updates that violateintegrity constraints are disallowed.•View deﬁnition.T h eSQL DDLincludes commands for deﬁning views.•Transaction control.SQLincludes commands for specifying the beginningand ending of transactions.•EmbeddedSQLanddynamicSQL.E m b e d d e da n dd y n a m i cSQLdeﬁne howSQLstatements can be embedded within general-purpose programming lan-guages, such as C, C++, and Java.•Authorization.T h eSQL DDLincludes commands for specifying access rightsto relations and views.In this chapter, we present a survey of basicDMLand theDDLfeatures ofSQL.Features described here have been part of theSQLstandard sinceSQL-92.In Chapter 4, we provide a more detailed coverage of theSQLquery language,including (a) various join expressions; (b) views; (c) transactions; (d) integrityconstraints; (e) type system; and (f) authorization.In', 'between implementa-tions. Most implementations support some nonstandard features, while omittingsupport for some of the more advanced features. In case you ﬁnd that some lan-guage features described here do not work on the database system that you use,consult the user manuals for your database system to ﬁnd exactly what featuresit supports.3.2SQL Data DeﬁnitionThe set of relations in a database mustbe speciﬁed to the system by means of adata-deﬁnition language (DDL). TheSQL DDLallows speciﬁcation of not only aset of relations, but also information about each relation, including:•The schema for each relation.•The types of values associated with each attribute.•The integrity constraints.•The set of indices to be maintained for each relation.']","Data integrity in SQL can be implemented using integrity constraints specified in the SQL Data Definition Language (DDL). These constraints include primary keys, foreign keys, unique constraints, and check constraints, which ensure that the data stored in the database adheres to specific rules and conditions. Updates that violate these integrity constraints are disallowed, maintaining the consistency and accuracy of the data.",The SQL DDL includes commands for specifying integrity constraints that the data stored in the database must satisfy. Updates that violate integrity constraints are disallowed.,0.973550368042328,0.9999999999833333,0.6,1.0,0.46326805249550795
2,What does char(n) and varchar(n) mean?,"['to prohibit null values from being entered, aswe shall see shortly.Thechardata type stores ﬁxed length strings. Consider, for example, anattributeAof typechar(10). If we store a string“Avi”in this attribute, 7 spacesare appended to the string to make it 10 characters long. In contrast, if attributeBwere of typevarchar(10), and we store“Avi”in attributeB,n os p a c e sw o u l db eadded. When comparing two values of typechar,i ft h e ya r eo fd i f f e r e n tl e n g t h sextra spaces are automatically added to the shorter one to make them the samesize, before comparison.When comparing achartype with avarchartype, one may expect extra spacesto be added to thevarchartype to make the lengths equal, before comparison;however, this may or may not be done, depending on the database system. As aresult, even if the same value“Avi”is stored in the attributesAandBabove, acomparisonA=Bmay return false. We recommend you always use thevarchartype instead of thechartype to avoid these problems.', 'to prohibit null values from being entered, aswe shall see shortly.Thechardata type stores ﬁxed length strings. Consider, for example, anattributeAof typechar(10). If we store a string“Avi”in this attribute, 7 spacesare appended to the string to make it 10 characters long. In contrast, if attributeBwere of typevarchar(10), and we store“Avi”in attributeB,n os p a c e sw o u l db eadded. When comparing two values of typechar,i ft h e ya r eo fd i f f e r e n tl e n g t h sextra spaces are automatically added to the shorter one to make them the samesize, before comparison.When comparing achartype with avarchartype, one may expect extra spacesto be added to thevarchartype to make the lengths equal, before comparison;however, this may or may not be done, depending on the database system. As aresult, even if the same value“Avi”is stored in the attributesAandBabove, acomparisonA=Bmay return false. We recommend you always use thevarchartype instead of thechartype to avoid these problems.', 'to prohibit null values from being entered, aswe shall see shortly.Thechardata type stores ﬁxed length strings. Consider, for example, anattributeAof typechar(10). If we store a string“Avi”in this attribute, 7 spacesare appended to the string to make it 10 characters long. In contrast, if attributeBwere of typevarchar(10), and we store“Avi”in attributeB,n os p a c e sw o u l db eadded. When comparing two values of typechar,i ft h e ya r eo fd i f f e r e n tl e n g t h sextra spaces are automatically added to the shorter one to make them the samesize, before comparison.When comparing achartype with avarchartype, one may expect extra spacesto be added to thevarchartype to make the lengths equal, before comparison;however, this may or may not be done, depending on the database system. As aresult, even if the same value“Avi”is stored in the attributesAandBabove, acomparisonA=Bmay return false. We recommend you always use thevarchartype instead of thechartype to avoid these problems.', 'to prohibit null values from being entered, aswe shall see shortly.Thechardata type stores ﬁxed length strings. Consider, for example, anattributeAof typechar(10). If we store a string“Avi”in this attribute, 7 spacesare appended to the string to make it 10 characters long. In contrast, if attributeBwere of typevarchar(10), and we store“Avi”in attributeB,n os p a c e sw o u l db eadded. When comparing two values of typechar,i ft h e ya r eo fd i f f e r e n tl e n g t h sextra spaces are automatically added to the shorter one to make them the samesize, before comparison.When comparing achartype with avarchartype, one may expect extra spacesto be added to thevarchartype to make the lengths equal, before comparison;however, this may or may not be done, depending on the database system. As aresult, even if the same value“Avi”is stored in the attributesAandBabove, acomparisonA=Bmay return false. We recommend you always use thevarchartype instead of thechartype to avoid these problems.', 'to prohibit null values from being entered, aswe shall see shortly.Thechardata type stores ﬁxed length strings. Consider, for example, anattributeAof typechar(10). If we store a string“Avi”in this attribute, 7 spacesare appended to the string to make it 10 characters long. In contrast, if attributeBwere of typevarchar(10), and we store“Avi”in attributeB,n os p a c e sw o u l db eadded. When comparing two values of typechar,i ft h e ya r eo fd i f f e r e n tl e n g t h sextra spaces are automatically added to the shorter one to make them the samesize, before comparison.When comparing achartype with avarchartype, one may expect extra spacesto be added to thevarchartype to make the lengths equal, before comparison;however, this may or may not be done, depending on the database system. As aresult, even if the same value“Avi”is stored in the attributesAandBabove, acomparisonA=Bmay return false. We recommend you always use thevarchartype instead of thechartype to avoid these problems.', '3.2SQL Data Deﬁnition59•The security and authorization information for each relation.•The physical storage structure of each relation on disk.We discuss here basic schema deﬁnition and basic types; we defer discussion ofthe otherSQL DDLfeatures to Chapters 4 and 5.3.2.1 Basic TypesTheSQLstandard supports a variety of built-in types, including:•char(n): A ﬁxed-length character string with user-speciﬁed lengthn.T h ef u l lform,character,c a nb eu s e di n s t e a d .•varchar(n): A variable-length character string with user-speciﬁed maximumlengthn.T h ef u l lf o r m ,character varying,i se q u i v a l e n t .•int: An integer (a ﬁnite subset of the integers that is machine dependent). Thefull form,integer,i se q u i v a l e n t .•smallint:As m a l li n t e g e r( am a c h i n e - d e p e n d e n ts u b s e to ft h ei n t e g e rt y p e ) .•numeric(p,d): A ﬁxed-point number with user-speciﬁed precision. The num-ber consists ofpdigits (plus a sign), anddof thepdigits are to the right ofthe']",`char(n)` is a fixed-length character string data type where the string is padded with spaces to ensure it is exactly `n` characters long. `varchar(n)` is a variable-length character string data type that can store up to `n` characters without adding extra spaces. It is generally recommended to use `varchar` over `char` to avoid issues with space padding during comparisons.,"char(n) is a fixed-length character string with user-specified length n. The full form, character, can be used instead. On the other hand, varchar(n) A variable-length character string with user-specified maximum length n. The full form, character varying, is equivalent.",0.8378987236210523,0.9999999999833333,1.0,1.0,0.46394487377415466
3,"To remove a table from SQL database, which sql query will be used?","['idof 1.c. Enroll every student in the Comp. Sci. department in the above sec-tion.d. Delete enrollments in the above section where the student’s name isChavez.e. Delete the course CS-001. What will happen if you run this deletestatement without ﬁrst deleting offerings (sections) of this course.f. Delete alltakestuples corresponding to any section of any course withthe word“database”as a part of the title; ignore case when matchingthe word with the title.3.13WriteSQL DDLcorresponding to the schema in Figure 3.18. Make anyreasonable assumptions about data types, and be sure to declare primaryand foreign keys.3.14Consider the insurance database of Figure 3.18, where the primary keysare underlined. Construct the followingSQLqueries for this relationaldatabase.a. Find the number of accidents in which the cars belonging to“JohnSmith”were involved.b. Update the damage amount for the car with the license number“AABB2000”in the accident with report number“AR2197”to $3000.3.15Consider the bank', '3.3Basic Structure of SQL Queries65\ndept\nname\nComp. Sci.\nFinance\nMusic\nPhysics\nHistory\nPhysics\nComp. Sci.\nHistory\nFinance\nBiology\nComp. Sci.\nElec. Eng.\nFigure 3.3Result of“selectdept\nnamefrominstructor”.if we want duplicates removed. The result of the above query would contain eachdepartment name at most once.SQLallows us to use the keywordallto specify explicitly that duplicates arenot removed:select alldept\nnamefrominstructor;Since duplicate retention is the default, we shall not useallin our examples. Toensure the elimination of duplicates in the results of our example queries, weshall usedistinctwhenever it is necessary.Theselectclause may also contain arithmetic expressions involving the op-erators+,−,∗,a n d/o p e r a t i n go nc o n s t a n t so ra t t r i b u t e so ft u p l e s .F o re x a m p l e ,the query:selectID,name,dept', '3.3Basic Structure of SQL Queries65\ndept\nname\nComp. Sci.\nFinance\nMusic\nPhysics\nHistory\nPhysics\nComp. Sci.\nHistory\nFinance\nBiology\nComp. Sci.\nElec. Eng.\nFigure 3.3Result of“selectdept\nnamefrominstructor”.if we want duplicates removed. The result of the above query would contain eachdepartment name at most once.SQLallows us to use the keywordallto specify explicitly that duplicates arenot removed:select alldept\nnamefrominstructor;Since duplicate retention is the default, we shall not useallin our examples. Toensure the elimination of duplicates in the results of our example queries, weshall usedistinctwhenever it is necessary.Theselectclause may also contain arithmetic expressions involving the op-erators+,−,∗,a n d/o p e r a t i n go nc o n s t a n t so ra t t r i b u t e so ft u p l e s .F o re x a m p l e ,the query:selectID,name,dept', '3.3Basic Structure of SQL Queries65\ndept\nname\nComp. Sci.\nFinance\nMusic\nPhysics\nHistory\nPhysics\nComp. Sci.\nHistory\nFinance\nBiology\nComp. Sci.\nElec. Eng.\nFigure 3.3Result of“selectdept\nnamefrominstructor”.if we want duplicates removed. The result of the above query would contain eachdepartment name at most once.SQLallows us to use the keywordallto specify explicitly that duplicates arenot removed:select alldept\nnamefrominstructor;Since duplicate retention is the default, we shall not useallin our examples. Toensure the elimination of duplicates in the results of our example queries, weshall usedistinctwhenever it is necessary.Theselectclause may also contain arithmetic expressions involving the op-erators+,−,∗,a n d/o p e r a t i n go nc o n s t a n t so ra t t r i b u t e so ft u p l e s .F o re x a m p l e ,the query:selectID,name,dept', '3.3Basic Structure of SQL Queries65\ndept\nname\nComp. Sci.\nFinance\nMusic\nPhysics\nHistory\nPhysics\nComp. Sci.\nHistory\nFinance\nBiology\nComp. Sci.\nElec. Eng.\nFigure 3.3Result of“selectdept\nnamefrominstructor”.if we want duplicates removed. The result of the above query would contain eachdepartment name at most once.SQLallows us to use the keywordallto specify explicitly that duplicates arenot removed:select alldept\nnamefrominstructor;Since duplicate retention is the default, we shall not useallin our examples. Toensure the elimination of duplicates in the results of our example queries, weshall usedistinctwhenever it is necessary.Theselectclause may also contain arithmetic expressions involving the op-erators+,−,∗,a n d/o p e r a t i n go nc o n s t a n t so ra t t r i b u t e so ft u p l e s .F o re x a m p l e ,the query:selectID,name,dept', '3.3Basic Structure of SQL Queries65\ndept\nname\nComp. Sci.\nFinance\nMusic\nPhysics\nHistory\nPhysics\nComp. Sci.\nHistory\nFinance\nBiology\nComp. Sci.\nElec. Eng.\nFigure 3.3Result of“selectdept\nnamefrominstructor”.if we want duplicates removed. The result of the above query would contain eachdepartment name at most once.SQLallows us to use the keywordallto specify explicitly that duplicates arenot removed:select alldept\nnamefrominstructor;Since duplicate retention is the default, we shall not useallin our examples. Toensure the elimination of duplicates in the results of our example queries, weshall usedistinctwhenever it is necessary.Theselectclause may also contain arithmetic expressions involving the op-erators+,−,∗,a n d/o p e r a t i n go nc o n s t a n t so ra t t r i b u t e so ft u p l e s .F o re x a m p l e ,the query:selectID,name,dept']","To remove a table from an SQL database, the `DROP TABLE` query is used. For example, `DROP TABLE table_name;` will delete the specified table and all its data.",We can use 'drop table r' to drop the specified table r from the database.,0.9405919616650787,0.0,0.0,1.0,0.5856516505235163
4,"Can select clause in sql contain arithmetic expressions like '+', '-' or '/'?","['98Chapter 3Introduction to SQLcan be used in theselectclause as illustrated in the following example that listsall departments along with the number of instructors in each department:selectdept\nname,(select count(*)frominstructorwheredepartment.dept\nname=instructor.dept\nname)asnum\ninstructorsfromdepartment;The subquery in the above example is guaranteed to return only a single valuesince it has acount(*) aggregate without agroup by.T h ee x a m p l ea l s oi l l u s t r a t e sthe usage of correlation variables, that is, attributes of relations in thefromclauseof the outer query, such asdepartment.dept', '98Chapter 3Introduction to SQLcan be used in theselectclause as illustrated in the following example that listsall departments along with the number of instructors in each department:selectdept\nname,(select count(*)frominstructorwheredepartment.dept\nname=instructor.dept\nname)asnum\ninstructorsfromdepartment;The subquery in the above example is guaranteed to return only a single valuesince it has acount(*) aggregate without agroup by.T h ee x a m p l ea l s oi l l u s t r a t e sthe usage of correlation variables, that is, attributes of relations in thefromclauseof the outer query, such asdepartment.dept', '98Chapter 3Introduction to SQLcan be used in theselectclause as illustrated in the following example that listsall departments along with the number of instructors in each department:selectdept\nname,(select count(*)frominstructorwheredepartment.dept\nname=instructor.dept\nname)asnum\ninstructorsfromdepartment;The subquery in the above example is guaranteed to return only a single valuesince it has acount(*) aggregate without agroup by.T h ee x a m p l ea l s oi l l u s t r a t e sthe usage of correlation variables, that is, attributes of relations in thefromclauseof the outer query, such asdepartment.dept', '98Chapter 3Introduction to SQLcan be used in theselectclause as illustrated in the following example that listsall departments along with the number of instructors in each department:selectdept\nname,(select count(*)frominstructorwheredepartment.dept\nname=instructor.dept\nname)asnum\ninstructorsfromdepartment;The subquery in the above example is guaranteed to return only a single valuesince it has acount(*) aggregate without agroup by.T h ee x a m p l ea l s oi l l u s t r a t e sthe usage of correlation variables, that is, attributes of relations in thefromclauseof the outer query, such asdepartment.dept', '98Chapter 3Introduction to SQLcan be used in theselectclause as illustrated in the following example that listsall departments along with the number of instructors in each department:selectdept\nname,(select count(*)frominstructorwheredepartment.dept\nname=instructor.dept\nname)asnum\ninstructorsfromdepartment;The subquery in the above example is guaranteed to return only a single valuesince it has acount(*) aggregate without agroup by.T h ee x a m p l ea l s oi l l u s t r a t e sthe usage of correlation variables, that is, attributes of relations in thefromclauseof the outer query, such asdepartment.dept', '92Chapter 3Introduction to SQLSQLdoes, however, offer an alternative style for writing the preceding query. Thephrase“greater than at least one”is represented inSQLby>some.T h i sc o n s t r u c tallows us to rewrite the query in a form that resembles closely our formulationof the query in English.selectnamefrominstructorwheresalary>some(selectsalaryfrominstructorwheredept\nname=’Biology’);The subquery:(selectsalaryfrominstructorwheredept']","Yes, the SELECT clause in SQL can contain arithmetic expressions such as '+', '-', '*', and '/'. These expressions can be used to perform calculations on the data retrieved from the database. For example, you can use `SELECT price * quantity AS total_cost FROM sales;` to calculate the total cost for each sale.",Yes. the artihmetic expressions with select clause let constant or attributes of tuples be operated.,0.9254629614996905,0.99999999998,0.0,0.5,0.6493774647883119
5,What is difference betwwen 'drop table' and 'delete from table' query?,"['3.3Basic Structure of SQL Queries65\ndept\nname\nComp. Sci.\nFinance\nMusic\nPhysics\nHistory\nPhysics\nComp. Sci.\nHistory\nFinance\nBiology\nComp. Sci.\nElec. Eng.\nFigure 3.3Result of“selectdept\nnamefrominstructor”.if we want duplicates removed. The result of the above query would contain eachdepartment name at most once.SQLallows us to use the keywordallto specify explicitly that duplicates arenot removed:select alldept\nnamefrominstructor;Since duplicate retention is the default, we shall not useallin our examples. Toensure the elimination of duplicates in the results of our example queries, weshall usedistinctwhenever it is necessary.Theselectclause may also contain arithmetic expressions involving the op-erators+,−,∗,a n d/o p e r a t i n go nc o n s t a n t so ra t t r i b u t e so ft u p l e s .F o re x a m p l e ,the query:selectID,name,dept', '3.3Basic Structure of SQL Queries65\ndept\nname\nComp. Sci.\nFinance\nMusic\nPhysics\nHistory\nPhysics\nComp. Sci.\nHistory\nFinance\nBiology\nComp. Sci.\nElec. Eng.\nFigure 3.3Result of“selectdept\nnamefrominstructor”.if we want duplicates removed. The result of the above query would contain eachdepartment name at most once.SQLallows us to use the keywordallto specify explicitly that duplicates arenot removed:select alldept\nnamefrominstructor;Since duplicate retention is the default, we shall not useallin our examples. Toensure the elimination of duplicates in the results of our example queries, weshall usedistinctwhenever it is necessary.Theselectclause may also contain arithmetic expressions involving the op-erators+,−,∗,a n d/o p e r a t i n go nc o n s t a n t so ra t t r i b u t e so ft u p l e s .F o re x a m p l e ,the query:selectID,name,dept', '3.3Basic Structure of SQL Queries65\ndept\nname\nComp. Sci.\nFinance\nMusic\nPhysics\nHistory\nPhysics\nComp. Sci.\nHistory\nFinance\nBiology\nComp. Sci.\nElec. Eng.\nFigure 3.3Result of“selectdept\nnamefrominstructor”.if we want duplicates removed. The result of the above query would contain eachdepartment name at most once.SQLallows us to use the keywordallto specify explicitly that duplicates arenot removed:select alldept\nnamefrominstructor;Since duplicate retention is the default, we shall not useallin our examples. Toensure the elimination of duplicates in the results of our example queries, weshall usedistinctwhenever it is necessary.Theselectclause may also contain arithmetic expressions involving the op-erators+,−,∗,a n d/o p e r a t i n go nc o n s t a n t so ra t t r i b u t e so ft u p l e s .F o re x a m p l e ,the query:selectID,name,dept', '3.3Basic Structure of SQL Queries65\ndept\nname\nComp. Sci.\nFinance\nMusic\nPhysics\nHistory\nPhysics\nComp. Sci.\nHistory\nFinance\nBiology\nComp. Sci.\nElec. Eng.\nFigure 3.3Result of“selectdept\nnamefrominstructor”.if we want duplicates removed. The result of the above query would contain eachdepartment name at most once.SQLallows us to use the keywordallto specify explicitly that duplicates arenot removed:select alldept\nnamefrominstructor;Since duplicate retention is the default, we shall not useallin our examples. Toensure the elimination of duplicates in the results of our example queries, weshall usedistinctwhenever it is necessary.Theselectclause may also contain arithmetic expressions involving the op-erators+,−,∗,a n d/o p e r a t i n go nc o n s t a n t so ra t t r i b u t e so ft u p l e s .F o re x a m p l e ,the query:selectID,name,dept', '3.3Basic Structure of SQL Queries65\ndept\nname\nComp. Sci.\nFinance\nMusic\nPhysics\nHistory\nPhysics\nComp. Sci.\nHistory\nFinance\nBiology\nComp. Sci.\nElec. Eng.\nFigure 3.3Result of“selectdept\nnamefrominstructor”.if we want duplicates removed. The result of the above query would contain eachdepartment name at most once.SQLallows us to use the keywordallto specify explicitly that duplicates arenot removed:select alldept\nnamefrominstructor;Since duplicate retention is the default, we shall not useallin our examples. Toensure the elimination of duplicates in the results of our example queries, weshall usedistinctwhenever it is necessary.Theselectclause may also contain arithmetic expressions involving the op-erators+,−,∗,a n d/o p e r a t i n go nc o n s t a n t so ra t t r i b u t e so ft u p l e s .F o re x a m p l e ,the query:selectID,name,dept', 'nameandcourse.dept\nnameto differ, and theSQLquery gives the correct answer.3.4Additional Basic OperationsThere are number of additional basico p e r a t i o n st h a ta r es u p p o r t e di nSQL.3.4.1 The Rename OperationConsider again the query that we used earlier:selectname,course\nidfrominstructor,teacheswhereinstructor.ID=teaches.ID;The result of this query is a relation with the following attributes:name,course']","The `DROP TABLE` query removes the entire table and all its data from the database, effectively deleting the table structure itself. In contrast, the `DELETE FROM table` query removes all or specific rows from a table but retains the table structure and its columns. Use `DROP TABLE` when you want to completely remove a table, and `DELETE FROM` when you want to clear or selectively remove data while keeping the table intact.","We can use the delete command to delete tuples from a relation. The command would delete all tuples from the relation. To remove a relation from an SQL database, we use the drop table command. The drop table command deletes all information about the dropped relation from the database.",0.8786069028178195,0.0,0.3333333333333333,1.0,0.7778268241963425
6,which command can we use to insert new attributes in relation?,"['relation are assignednullas the value for the new attribute. The formof thealter tablecommand isalter tableraddAD;whereris the name of an existing relation,Ais the name of the attribute to beadded, andDis the type of the added attribute. We can drop attributes from arelation by the commandalter tablerdropA;whereris the name of an existing relation, andAis the name of an attribute of therelation. Many database systems do not support dropping of attributes, althoughthey will allow an entire table to be dropped.3.3Basic Structure of SQL QueriesThe basic structure of anSQLquery consists of three clauses:select,from,a n dwhere.T h eq u e r yt a k e sa si t si n p u tt h er e l a t i o n sl i s t e di nt h efromclause, operateson them as speciﬁed in thewhereandselectclauses, and then produces a relationas the result. We introduce theSQLsyntax through examples, and describe thegeneral structure ofSQLqueries later.3.3.1 Queries on a Single RelationLet us consider a simple query using our', 'relation are assignednullas the value for the new attribute. The formof thealter tablecommand isalter tableraddAD;whereris the name of an existing relation,Ais the name of the attribute to beadded, andDis the type of the added attribute. We can drop attributes from arelation by the commandalter tablerdropA;whereris the name of an existing relation, andAis the name of an attribute of therelation. Many database systems do not support dropping of attributes, althoughthey will allow an entire table to be dropped.3.3Basic Structure of SQL QueriesThe basic structure of anSQLquery consists of three clauses:select,from,a n dwhere.T h eq u e r yt a k e sa si t si n p u tt h er e l a t i o n sl i s t e di nt h efromclause, operateson them as speciﬁed in thewhereandselectclauses, and then produces a relationas the result. We introduce theSQLsyntax through examples, and describe thegeneral structure ofSQLqueries later.3.3.1 Queries on a Single RelationLet us consider a simple query using our', 'relation are assignednullas the value for the new attribute. The formof thealter tablecommand isalter tableraddAD;whereris the name of an existing relation,Ais the name of the attribute to beadded, andDis the type of the added attribute. We can drop attributes from arelation by the commandalter tablerdropA;whereris the name of an existing relation, andAis the name of an attribute of therelation. Many database systems do not support dropping of attributes, althoughthey will allow an entire table to be dropped.3.3Basic Structure of SQL QueriesThe basic structure of anSQLquery consists of three clauses:select,from,a n dwhere.T h eq u e r yt a k e sa si t si n p u tt h er e l a t i o n sl i s t e di nt h efromclause, operateson them as speciﬁed in thewhereandselectclauses, and then produces a relationas the result. We introduce theSQLsyntax through examples, and describe thegeneral structure ofSQLqueries later.3.3.1 Queries on a Single RelationLet us consider a simple query using our', 'relation are assignednullas the value for the new attribute. The formof thealter tablecommand isalter tableraddAD;whereris the name of an existing relation,Ais the name of the attribute to beadded, andDis the type of the added attribute. We can drop attributes from arelation by the commandalter tablerdropA;whereris the name of an existing relation, andAis the name of an attribute of therelation. Many database systems do not support dropping of attributes, althoughthey will allow an entire table to be dropped.3.3Basic Structure of SQL QueriesThe basic structure of anSQLquery consists of three clauses:select,from,a n dwhere.T h eq u e r yt a k e sa si t si n p u tt h er e l a t i o n sl i s t e di nt h efromclause, operateson them as speciﬁed in thewhereandselectclauses, and then produces a relationas the result. We introduce theSQLsyntax through examples, and describe thegeneral structure ofSQLqueries later.3.3.1 Queries on a Single RelationLet us consider a simple query using our', 'relation are assignednullas the value for the new attribute. The formof thealter tablecommand isalter tableraddAD;whereris the name of an existing relation,Ais the name of the attribute to beadded, andDis the type of the added attribute. We can drop attributes from arelation by the commandalter tablerdropA;whereris the name of an existing relation, andAis the name of an attribute of therelation. Many database systems do not support dropping of attributes, althoughthey will allow an entire table to be dropped.3.3Basic Structure of SQL QueriesThe basic structure of anSQLquery consists of three clauses:select,from,a n dwhere.T h eq u e r yt a k e sa si t si n p u tt h er e l a t i o n sl i s t e di nt h efromclause, operateson them as speciﬁed in thewhereandselectclauses, and then produces a relationas the result. We introduce theSQLsyntax through examples, and describe thegeneral structure ofSQLqueries later.3.3.1 Queries on a Single RelationLet us consider a simple query using our', 'in bothriandrj,a sw es a we a r l i e r ,we preﬁx the the name of the relation from which the attribute originally came,before the attribute name.For example, the relation schema for the Cartesian product of relationsin-structorandteachesis:(instructor.ID,instructor.name,instructor.dept']","To insert new attributes in a relation, you can use the `ALTER TABLE` command. The syntax is `ALTER TABLE r ADD A D;` where `r` is the name of the existing relation, `A` is the name of the attribute to be added, and `D` is the type of the added attribute.",We use the alter table command to add attributes to an existing relation. All tuples in the relation are assigned null as the value for the new attribute.,0.937722159679045,0.99999999998,1.0,1.0,0.7866256798796794
7,"In the case that we want to eliminate duplicates from select operation, which keyword should be applied with?","['3.3Basic Structure of SQL Queries65\ndept\nname\nComp. Sci.\nFinance\nMusic\nPhysics\nHistory\nPhysics\nComp. Sci.\nHistory\nFinance\nBiology\nComp. Sci.\nElec. Eng.\nFigure 3.3Result of“selectdept\nnamefrominstructor”.if we want duplicates removed. The result of the above query would contain eachdepartment name at most once.SQLallows us to use the keywordallto specify explicitly that duplicates arenot removed:select alldept\nnamefrominstructor;Since duplicate retention is the default, we shall not useallin our examples. Toensure the elimination of duplicates in the results of our example queries, weshall usedistinctwhenever it is necessary.Theselectclause may also contain arithmetic expressions involving the op-erators+,−,∗,a n d/o p e r a t i n go nc o n s t a n t so ra t t r i b u t e so ft u p l e s .F o re x a m p l e ,the query:selectID,name,dept', '3.3Basic Structure of SQL Queries65\ndept\nname\nComp. Sci.\nFinance\nMusic\nPhysics\nHistory\nPhysics\nComp. Sci.\nHistory\nFinance\nBiology\nComp. Sci.\nElec. Eng.\nFigure 3.3Result of“selectdept\nnamefrominstructor”.if we want duplicates removed. The result of the above query would contain eachdepartment name at most once.SQLallows us to use the keywordallto specify explicitly that duplicates arenot removed:select alldept\nnamefrominstructor;Since duplicate retention is the default, we shall not useallin our examples. Toensure the elimination of duplicates in the results of our example queries, weshall usedistinctwhenever it is necessary.Theselectclause may also contain arithmetic expressions involving the op-erators+,−,∗,a n d/o p e r a t i n go nc o n s t a n t so ra t t r i b u t e so ft u p l e s .F o re x a m p l e ,the query:selectID,name,dept', '3.3Basic Structure of SQL Queries65\ndept\nname\nComp. Sci.\nFinance\nMusic\nPhysics\nHistory\nPhysics\nComp. Sci.\nHistory\nFinance\nBiology\nComp. Sci.\nElec. Eng.\nFigure 3.3Result of“selectdept\nnamefrominstructor”.if we want duplicates removed. The result of the above query would contain eachdepartment name at most once.SQLallows us to use the keywordallto specify explicitly that duplicates arenot removed:select alldept\nnamefrominstructor;Since duplicate retention is the default, we shall not useallin our examples. Toensure the elimination of duplicates in the results of our example queries, weshall usedistinctwhenever it is necessary.Theselectclause may also contain arithmetic expressions involving the op-erators+,−,∗,a n d/o p e r a t i n go nc o n s t a n t so ra t t r i b u t e so ft u p l e s .F o re x a m p l e ,the query:selectID,name,dept', '3.3Basic Structure of SQL Queries65\ndept\nname\nComp. Sci.\nFinance\nMusic\nPhysics\nHistory\nPhysics\nComp. Sci.\nHistory\nFinance\nBiology\nComp. Sci.\nElec. Eng.\nFigure 3.3Result of“selectdept\nnamefrominstructor”.if we want duplicates removed. The result of the above query would contain eachdepartment name at most once.SQLallows us to use the keywordallto specify explicitly that duplicates arenot removed:select alldept\nnamefrominstructor;Since duplicate retention is the default, we shall not useallin our examples. Toensure the elimination of duplicates in the results of our example queries, weshall usedistinctwhenever it is necessary.Theselectclause may also contain arithmetic expressions involving the op-erators+,−,∗,a n d/o p e r a t i n go nc o n s t a n t so ra t t r i b u t e so ft u p l e s .F o re x a m p l e ,the query:selectID,name,dept', '3.3Basic Structure of SQL Queries65\ndept\nname\nComp. Sci.\nFinance\nMusic\nPhysics\nHistory\nPhysics\nComp. Sci.\nHistory\nFinance\nBiology\nComp. Sci.\nElec. Eng.\nFigure 3.3Result of“selectdept\nnamefrominstructor”.if we want duplicates removed. The result of the above query would contain eachdepartment name at most once.SQLallows us to use the keywordallto specify explicitly that duplicates arenot removed:select alldept\nnamefrominstructor;Since duplicate retention is the default, we shall not useallin our examples. Toensure the elimination of duplicates in the results of our example queries, weshall usedistinctwhenever it is necessary.Theselectclause may also contain arithmetic expressions involving the op-erators+,−,∗,a n d/o p e r a t i n go nc o n s t a n t so ra t t r i b u t e so ft u p l e s .F o re x a m p l e ,the query:selectID,name,dept', '94Chapter 3Introduction to SQLselect distinctS.ID,S.namefromstudentasSwhere not exists((selectcourse\nidfromcoursewheredept\nname=’Biology’)except(selectT.course\nidfromtakesasTwhereS.ID=T.ID));Here, the subquery:(selectcourse\nidfromcoursewheredept\nname=’Biology’)ﬁnds the set of all courses offered in the Biology department. The subquery:(selectT.course\nidfromtakesasTwhereS.ID=T.ID)ﬁnds all the courses that studentS.IDhas taken. Thus, the outerselecttakes eachstudent and tests whether the set of all courses that the student has taken containsthe set of all courses offered in the Biology department.3.8.4 Test for the Absence of Duplicate TuplesSQLincludes a boolean function for testingw h e t h e ras u b q u e r yh a sd u p l i c a t etuples in its result. Theuniqueconstruct9returns the valuetrueif the argumentsubquery contains no duplicate tuples. Using theuniqueconstruct, we can writethe query“Find all courses that were offered at most once in 2009”as follows:selectT.course']","To eliminate duplicates from a SELECT operation, the keyword `DISTINCT` should be applied.","In those cases where we want to force the elimination of duplicates, we insert the keyword distinct after select",0.9145243511167983,0.9999999999833333,1.0,1.0,0.22587520483359785
8,Do we have to use 'all' keyword to see the result with duplicates not removed?,"['3.3Basic Structure of SQL Queries65\ndept\nname\nComp. Sci.\nFinance\nMusic\nPhysics\nHistory\nPhysics\nComp. Sci.\nHistory\nFinance\nBiology\nComp. Sci.\nElec. Eng.\nFigure 3.3Result of“selectdept\nnamefrominstructor”.if we want duplicates removed. The result of the above query would contain eachdepartment name at most once.SQLallows us to use the keywordallto specify explicitly that duplicates arenot removed:select alldept\nnamefrominstructor;Since duplicate retention is the default, we shall not useallin our examples. Toensure the elimination of duplicates in the results of our example queries, weshall usedistinctwhenever it is necessary.Theselectclause may also contain arithmetic expressions involving the op-erators+,−,∗,a n d/o p e r a t i n go nc o n s t a n t so ra t t r i b u t e so ft u p l e s .F o re x a m p l e ,the query:selectID,name,dept', '3.3Basic Structure of SQL Queries65\ndept\nname\nComp. Sci.\nFinance\nMusic\nPhysics\nHistory\nPhysics\nComp. Sci.\nHistory\nFinance\nBiology\nComp. Sci.\nElec. Eng.\nFigure 3.3Result of“selectdept\nnamefrominstructor”.if we want duplicates removed. The result of the above query would contain eachdepartment name at most once.SQLallows us to use the keywordallto specify explicitly that duplicates arenot removed:select alldept\nnamefrominstructor;Since duplicate retention is the default, we shall not useallin our examples. Toensure the elimination of duplicates in the results of our example queries, weshall usedistinctwhenever it is necessary.Theselectclause may also contain arithmetic expressions involving the op-erators+,−,∗,a n d/o p e r a t i n go nc o n s t a n t so ra t t r i b u t e so ft u p l e s .F o re x a m p l e ,the query:selectID,name,dept', '3.3Basic Structure of SQL Queries65\ndept\nname\nComp. Sci.\nFinance\nMusic\nPhysics\nHistory\nPhysics\nComp. Sci.\nHistory\nFinance\nBiology\nComp. Sci.\nElec. Eng.\nFigure 3.3Result of“selectdept\nnamefrominstructor”.if we want duplicates removed. The result of the above query would contain eachdepartment name at most once.SQLallows us to use the keywordallto specify explicitly that duplicates arenot removed:select alldept\nnamefrominstructor;Since duplicate retention is the default, we shall not useallin our examples. Toensure the elimination of duplicates in the results of our example queries, weshall usedistinctwhenever it is necessary.Theselectclause may also contain arithmetic expressions involving the op-erators+,−,∗,a n d/o p e r a t i n go nc o n s t a n t so ra t t r i b u t e so ft u p l e s .F o re x a m p l e ,the query:selectID,name,dept', '3.3Basic Structure of SQL Queries65\ndept\nname\nComp. Sci.\nFinance\nMusic\nPhysics\nHistory\nPhysics\nComp. Sci.\nHistory\nFinance\nBiology\nComp. Sci.\nElec. Eng.\nFigure 3.3Result of“selectdept\nnamefrominstructor”.if we want duplicates removed. The result of the above query would contain eachdepartment name at most once.SQLallows us to use the keywordallto specify explicitly that duplicates arenot removed:select alldept\nnamefrominstructor;Since duplicate retention is the default, we shall not useallin our examples. Toensure the elimination of duplicates in the results of our example queries, weshall usedistinctwhenever it is necessary.Theselectclause may also contain arithmetic expressions involving the op-erators+,−,∗,a n d/o p e r a t i n go nc o n s t a n t so ra t t r i b u t e so ft u p l e s .F o re x a m p l e ,the query:selectID,name,dept', '3.3Basic Structure of SQL Queries65\ndept\nname\nComp. Sci.\nFinance\nMusic\nPhysics\nHistory\nPhysics\nComp. Sci.\nHistory\nFinance\nBiology\nComp. Sci.\nElec. Eng.\nFigure 3.3Result of“selectdept\nnamefrominstructor”.if we want duplicates removed. The result of the above query would contain eachdepartment name at most once.SQLallows us to use the keywordallto specify explicitly that duplicates arenot removed:select alldept\nnamefrominstructor;Since duplicate retention is the default, we shall not useallin our examples. Toensure the elimination of duplicates in the results of our example queries, weshall usedistinctwhenever it is necessary.Theselectclause may also contain arithmetic expressions involving the op-erators+,−,∗,a n d/o p e r a t i n go nc o n s t a n t so ra t t r i b u t e so ft u p l e s .F o re x a m p l e ,the query:selectID,name,dept', '3.8Nested Subqueries91This example shows that it is possible to write the same query several ways inSQL.T h i sﬂ e x i b i l i t yi sb e n e ﬁ c i a l ,s i n c ei ta l l o w sau s e rt ot h i n ka b o u tt h eq u e r yi nthe way that seems most natural. We shall see that there is a substantial amountof redundancy inSQL.We use thenot inconstruct in a way similar to theinconstruct. For example,to ﬁnd all the courses taught in the Fall 2009 semester but not in the Spring 2010semester, we can write:select distinctcourse\nidfromsectionwheresemester=’Fall’andyear=2009andcourse\nidnot in(selectcourse']","No, you do not have to use the `ALL` keyword to see results with duplicates not removed, as duplicate retention is the default behavior in SQL. The `ALL` keyword is used explicitly to specify that duplicates should not be removed, but it is not necessary to use it for this purpose.","Since duplicate retention is the default, we shall not use all in our examples.",0.9423815488575255,0.9999999999833333,1.0,1.0,0.5887085462539514
9,"If the user wants to get a name of instructors who belongs to 'Comp.sci' department, which query should be implemented? The instructor table has 3 attributes name, department, and salary.","['86Chapter 3Introduction to SQL\nID\nname\ndept\nname\nsalary\n76766\nCrick\nBiology\n72000\n45565\nKatz\nComp. Sci.\n75000\n10101\nSrinivasan\nComp. Sci.\n65000\n83821\nBrandt\nComp. Sci.\n92000\n98345\nKim\nElec. Eng.\n80000\n12121\nWu\nFinance\n90000\n76543\nSingh\nFinance\n80000\n32343\nEl Said\nHistory\n60000\n58583\nCaliﬁeri\nHistory\n62000\n15151\nMozart\nMusic\n40000\n33456\nGold\nPhysics\n87000\n22222\nEinstein\nPhysics\n95000\nFigure 3.14Tuples of theinstructorrelation, grouped by thedept', '86Chapter 3Introduction to SQL\nID\nname\ndept\nname\nsalary\n76766\nCrick\nBiology\n72000\n45565\nKatz\nComp. Sci.\n75000\n10101\nSrinivasan\nComp. Sci.\n65000\n83821\nBrandt\nComp. Sci.\n92000\n98345\nKim\nElec. Eng.\n80000\n12121\nWu\nFinance\n90000\n76543\nSingh\nFinance\n80000\n32343\nEl Said\nHistory\n60000\n58583\nCaliﬁeri\nHistory\n62000\n15151\nMozart\nMusic\n40000\n33456\nGold\nPhysics\n87000\n22222\nEinstein\nPhysics\n95000\nFigure 3.14Tuples of theinstructorrelation, grouped by thedept', '86Chapter 3Introduction to SQL\nID\nname\ndept\nname\nsalary\n76766\nCrick\nBiology\n72000\n45565\nKatz\nComp. Sci.\n75000\n10101\nSrinivasan\nComp. Sci.\n65000\n83821\nBrandt\nComp. Sci.\n92000\n98345\nKim\nElec. Eng.\n80000\n12121\nWu\nFinance\n90000\n76543\nSingh\nFinance\n80000\n32343\nEl Said\nHistory\n60000\n58583\nCaliﬁeri\nHistory\n62000\n15151\nMozart\nMusic\n40000\n33456\nGold\nPhysics\n87000\n22222\nEinstein\nPhysics\n95000\nFigure 3.14Tuples of theinstructorrelation, grouped by thedept', '86Chapter 3Introduction to SQL\nID\nname\ndept\nname\nsalary\n76766\nCrick\nBiology\n72000\n45565\nKatz\nComp. Sci.\n75000\n10101\nSrinivasan\nComp. Sci.\n65000\n83821\nBrandt\nComp. Sci.\n92000\n98345\nKim\nElec. Eng.\n80000\n12121\nWu\nFinance\n90000\n76543\nSingh\nFinance\n80000\n32343\nEl Said\nHistory\n60000\n58583\nCaliﬁeri\nHistory\n62000\n15151\nMozart\nMusic\n40000\n33456\nGold\nPhysics\n87000\n22222\nEinstein\nPhysics\n95000\nFigure 3.14Tuples of theinstructorrelation, grouped by thedept', '86Chapter 3Introduction to SQL\nID\nname\ndept\nname\nsalary\n76766\nCrick\nBiology\n72000\n45565\nKatz\nComp. Sci.\n75000\n10101\nSrinivasan\nComp. Sci.\n65000\n83821\nBrandt\nComp. Sci.\n92000\n98345\nKim\nElec. Eng.\n80000\n12121\nWu\nFinance\n90000\n76543\nSingh\nFinance\n80000\n32343\nEl Said\nHistory\n60000\n58583\nCaliﬁeri\nHistory\n62000\n15151\nMozart\nMusic\n40000\n33456\nGold\nPhysics\n87000\n22222\nEinstein\nPhysics\n95000\nFigure 3.14Tuples of theinstructorrelation, grouped by thedept', '3.3Basic Structure of SQL Queries67\nname\ndept\nname\nbuilding\nSrinivasan\nComp. Sci.\nTaylor\nWu\nFinance\nPainter\nMozart\nMusic\nPackard\nEinstein\nPhysics\nWatson\nEl Said\nHistory\nPainter\nGold\nPhysics\nWatson\nKatz\nComp. Sci.\nTaylor\nCaliﬁeri\nHistory\nPainter\nSingh\nFinance\nPainter\nCrick\nBiology\nWatson\nBrandt\nComp. Sci.\nTaylor\nKim\nElec. Eng.\nTaylor\nFigure 3.5The result of“Retrieve the names of all instructors, along with their departmentnames and department building name.”department.dept']","To get the names of instructors who belong to the 'Comp. Sci.' department, the following SQL query should be implemented: 

```sql
SELECT name FROM instructor WHERE dept = 'Comp. Sci.';
```","To filter results with condition, we can use 'where' keywords. 'select name from instructors where department='Comp.sci' is desirable.",0.9235719261225029,0.9999999999833333,0.5,1.0,0.5986223134507305
10,What does 'null' mean in SQL?,"['for example+,−,∗,o r/)i snull if any of the input values is null. For example, if a query has an expressionr.A+5, andr.Ais null for a particular tuple, then the expression result must alsobe null for that tuple.Comparisons involving nulls are more of a problem. For example, considerthe comparison“1<null”.I tw o u l db ew r o n gt os a yt h i si st r u es i n c ew ed on o tknow what the null value represents. But it would likewise be wrong to claim thisexpression is false; if we did,“not(1<null)”would evaluate to true, which doesnot make sense.SQLtherefore treats asunknownthe result of any comparisoninvolving anullvalue (other than predicatesis nullandis not null,w h i c ha r edescribed later in this section). This creates a third logical value in addition totrueandfalse.Since the predicate in awhereclause can involve Boolean operations suchasand,or,a n dnoton the results of comparisons, the deﬁnitions of the Booleanoperations are extended to deal with the valueunknown.•and: The result', 'for example+,−,∗,o r/)i snull if any of the input values is null. For example, if a query has an expressionr.A+5, andr.Ais null for a particular tuple, then the expression result must alsobe null for that tuple.Comparisons involving nulls are more of a problem. For example, considerthe comparison“1<null”.I tw o u l db ew r o n gt os a yt h i si st r u es i n c ew ed on o tknow what the null value represents. But it would likewise be wrong to claim thisexpression is false; if we did,“not(1<null)”would evaluate to true, which doesnot make sense.SQLtherefore treats asunknownthe result of any comparisoninvolving anullvalue (other than predicatesis nullandis not null,w h i c ha r edescribed later in this section). This creates a third logical value in addition totrueandfalse.Since the predicate in awhereclause can involve Boolean operations suchasand,or,a n dnoton the results of comparisons, the deﬁnitions of the Booleanoperations are extended to deal with the valueunknown.•and: The result', 'for example+,−,∗,o r/)i snull if any of the input values is null. For example, if a query has an expressionr.A+5, andr.Ais null for a particular tuple, then the expression result must alsobe null for that tuple.Comparisons involving nulls are more of a problem. For example, considerthe comparison“1<null”.I tw o u l db ew r o n gt os a yt h i si st r u es i n c ew ed on o tknow what the null value represents. But it would likewise be wrong to claim thisexpression is false; if we did,“not(1<null)”would evaluate to true, which doesnot make sense.SQLtherefore treats asunknownthe result of any comparisoninvolving anullvalue (other than predicatesis nullandis not null,w h i c ha r edescribed later in this section). This creates a third logical value in addition totrueandfalse.Since the predicate in awhereclause can involve Boolean operations suchasand,or,a n dnoton the results of comparisons, the deﬁnitions of the Booleanoperations are extended to deal with the valueunknown.•and: The result', 'for example+,−,∗,o r/)i snull if any of the input values is null. For example, if a query has an expressionr.A+5, andr.Ais null for a particular tuple, then the expression result must alsobe null for that tuple.Comparisons involving nulls are more of a problem. For example, considerthe comparison“1<null”.I tw o u l db ew r o n gt os a yt h i si st r u es i n c ew ed on o tknow what the null value represents. But it would likewise be wrong to claim thisexpression is false; if we did,“not(1<null)”would evaluate to true, which doesnot make sense.SQLtherefore treats asunknownthe result of any comparisoninvolving anullvalue (other than predicatesis nullandis not null,w h i c ha r edescribed later in this section). This creates a third logical value in addition totrueandfalse.Since the predicate in awhereclause can involve Boolean operations suchasand,or,a n dnoton the results of comparisons, the deﬁnitions of the Booleanoperations are extended to deal with the valueunknown.•and: The result', 'for example+,−,∗,o r/)i snull if any of the input values is null. For example, if a query has an expressionr.A+5, andr.Ais null for a particular tuple, then the expression result must alsobe null for that tuple.Comparisons involving nulls are more of a problem. For example, considerthe comparison“1<null”.I tw o u l db ew r o n gt os a yt h i si st r u es i n c ew ed on o tknow what the null value represents. But it would likewise be wrong to claim thisexpression is false; if we did,“not(1<null)”would evaluate to true, which doesnot make sense.SQLtherefore treats asunknownthe result of any comparisoninvolving anullvalue (other than predicatesis nullandis not null,w h i c ha r edescribed later in this section). This creates a third logical value in addition totrueandfalse.Since the predicate in awhereclause can involve Boolean operations suchasand,or,a n dnoton the results of comparisons, the deﬁnitions of the Booleanoperations are extended to deal with the valueunknown.•and: The result', '90Chapter 3Introduction to SQLreturn a value of null when applied on an empty collection. The effect of nullvalues on some of the more complicatedSQLconstructs can be subtle.ABooleandata type that can take valuestrue,false,a n dunknown,w a sintroduced inSQL:1999.T h ea g g r e g a t ef u n c t i o n ssomeandevery,w h i c hm e a nexactly what you would intuitively expect, can be applied on a collection ofBoolean values.3.8Nested SubqueriesSQLprovides a mechanism for nesting subqueries. A subquery is aselect-from-whereexpression that is nested within another query. A common use of sub-queries is to perform tests for set membership, make set comparisons, and deter-mine set cardinality, by nesting subqueries in thewhereclause. We study suchuses of nested subqueries in thewhereclause in Sections 3.8.1 through 3.8.4. InSection 3.8.5, we study nesting of subqueries in thefromclause. In Section 3.8.7,we see how a class of subqueries called scalar subqueries can appear whereveran expression']","In SQL, 'null' represents a missing or unknown value. It is not equivalent to zero or an empty string, and any arithmetic or comparison operation involving null results in null or unknown. This introduces a third logical value in SQL, in addition to true and false.",SQL handles queries on relations containing null values by adding the truth value “unknown” to the usual truth values of true and false.,0.9564280765165866,0.9999999999833333,0.5,1.0,0.2199743667174151
11,What is scalar subqueries?,"['namein the above example.Scalar subqueries can occur inselect,where,a n dhavingclauses. Scalar sub-queries may also be deﬁned without aggregates. It is not always possible to ﬁgureout at compile time if a subquery can return more than one tuple in its result;if the result has more than one tuple whenthe subquery is executed, a run-timeerror occurs.Note that technically the type of a scalar subquery result is still a relation,even if it contains a single tuple. However, when a scalar subquery is used in anexpression where a value is expected,SQLimplicitly extracts the value from thesingle attribute of the single tuple in the relation, and returns that value.3.9Modiﬁcation of the DatabaseWe have restricted our attention until now to the extraction of information fromthe database. Now, we show how to add,remove, or change information withSQL.3.9.1 DeletionAd e l e t er e q u e s ti se x p r e s s e di nm u c ht h es a m ew a ya saq u e r y .W ec a nd e l e t eo n l ywhole tuples; we', 'namein the above example.Scalar subqueries can occur inselect,where,a n dhavingclauses. Scalar sub-queries may also be deﬁned without aggregates. It is not always possible to ﬁgureout at compile time if a subquery can return more than one tuple in its result;if the result has more than one tuple whenthe subquery is executed, a run-timeerror occurs.Note that technically the type of a scalar subquery result is still a relation,even if it contains a single tuple. However, when a scalar subquery is used in anexpression where a value is expected,SQLimplicitly extracts the value from thesingle attribute of the single tuple in the relation, and returns that value.3.9Modiﬁcation of the DatabaseWe have restricted our attention until now to the extraction of information fromthe database. Now, we show how to add,remove, or change information withSQL.3.9.1 DeletionAd e l e t er e q u e s ti se x p r e s s e di nm u c ht h es a m ew a ya saq u e r y .W ec a nd e l e t eo n l ywhole tuples; we', 'namein the above example.Scalar subqueries can occur inselect,where,a n dhavingclauses. Scalar sub-queries may also be deﬁned without aggregates. It is not always possible to ﬁgureout at compile time if a subquery can return more than one tuple in its result;if the result has more than one tuple whenthe subquery is executed, a run-timeerror occurs.Note that technically the type of a scalar subquery result is still a relation,even if it contains a single tuple. However, when a scalar subquery is used in anexpression where a value is expected,SQLimplicitly extracts the value from thesingle attribute of the single tuple in the relation, and returns that value.3.9Modiﬁcation of the DatabaseWe have restricted our attention until now to the extraction of information fromthe database. Now, we show how to add,remove, or change information withSQL.3.9.1 DeletionAd e l e t er e q u e s ti se x p r e s s e di nm u c ht h es a m ew a ya saq u e r y .W ec a nd e l e t eo n l ywhole tuples; we', 'namein the above example.Scalar subqueries can occur inselect,where,a n dhavingclauses. Scalar sub-queries may also be deﬁned without aggregates. It is not always possible to ﬁgureout at compile time if a subquery can return more than one tuple in its result;if the result has more than one tuple whenthe subquery is executed, a run-timeerror occurs.Note that technically the type of a scalar subquery result is still a relation,even if it contains a single tuple. However, when a scalar subquery is used in anexpression where a value is expected,SQLimplicitly extracts the value from thesingle attribute of the single tuple in the relation, and returns that value.3.9Modiﬁcation of the DatabaseWe have restricted our attention until now to the extraction of information fromthe database. Now, we show how to add,remove, or change information withSQL.3.9.1 DeletionAd e l e t er e q u e s ti se x p r e s s e di nm u c ht h es a m ew a ya saq u e r y .W ec a nd e l e t eo n l ywhole tuples; we', 'namein the above example.Scalar subqueries can occur inselect,where,a n dhavingclauses. Scalar sub-queries may also be deﬁned without aggregates. It is not always possible to ﬁgureout at compile time if a subquery can return more than one tuple in its result;if the result has more than one tuple whenthe subquery is executed, a run-timeerror occurs.Note that technically the type of a scalar subquery result is still a relation,even if it contains a single tuple. However, when a scalar subquery is used in anexpression where a value is expected,SQLimplicitly extracts the value from thesingle attribute of the single tuple in the relation, and returns that value.3.9Modiﬁcation of the DatabaseWe have restricted our attention until now to the extraction of information fromthe database. Now, we show how to add,remove, or change information withSQL.3.9.1 DeletionAd e l e t er e q u e s ti se x p r e s s e di nm u c ht h es a m ew a ya saq u e r y .W ec a nd e l e t eo n l ywhole tuples; we', '3.8.1 through 3.8.4. InSection 3.8.5, we study nesting of subqueries in thefromclause. In Section 3.8.7,we see how a class of subqueries called scalar subqueries can appear whereveran expression returning a value can occur.3.8.1 Set MembershipSQLallows testing tuples for membership in a relation. Theinconnective testsfor set membership, where the set is a collection of values produced by aselectclause. Thenot inconnective tests for the absence of set membership.As an illustration, reconsider the query“Find all the courses taught in theboth the Fall 2009 and Spring 2010 semesters.”Earlier, we wrote such a query byintersecting two sets: the set of courses taught in Fall 2009 and the set of coursestaught in Spring 2010. We can take the alternative approach of ﬁnding all coursesthat were taught in Fall 2009 and that are also members of the set of coursestaught in Spring 2010. Clearly, this formulation generates the same results as theprevious one did, but it leads us to write our query']","Scalar subqueries are subqueries that return a single value, which can be used in places where a single value is expected, such as in `SELECT`, `WHERE`, and `HAVING` clauses. Even though the result of a scalar subquery is technically a relation, SQL implicitly extracts the value from the single attribute of the single tuple in the relation. If a scalar subquery returns more than one tuple, a runtime error occurs.","SQL allows subqueries to occur wherever an expression returning a value is permitted, provided the subquery returns only one tuple containing a single attribute; such subqueries are called scalar subqueries.",0.8903605998132497,0.9999999999833333,1.0,1.0,0.5687137837125449
12,Is condition in 'having' clause applied to a sinlge tuple?,"['88Chapter 3Introduction to SQL/* erroneous query */selectdept\nname,ID,avg(salary)frominstructorgroup bydept\nname;Each instructor in a particular group (deﬁned bydept\nname)c a nh a v ead i f f e r e n tID,a n ds i n c eo n l yo n et u p l ei so u t p u tf o re a c hg r o u p ,t h e r ei sn ou n i q u ew a yo fchoosing whichIDvalue to output. As a result, such cases are disallowed bySQL.3.7.3 The Having ClauseAt times, it is useful to state a condition that applies to groups rather than totuples. For example, we might be interested in only those departments where theaverage salary of the instructors is more than $42,000. This condition does notapply to a single tuple; rather, it applies to each group constructed by thegroupbyclause. To express such a query, we use thehavingclause ofSQL.SQLappliespredicates in thehavingclause after groups have been formed, so aggregatefunctions may be used. We express this query inSQLas follows:selectdept\nname,avg(salary)asavg', '88Chapter 3Introduction to SQL/* erroneous query */selectdept\nname,ID,avg(salary)frominstructorgroup bydept\nname;Each instructor in a particular group (deﬁned bydept\nname)c a nh a v ead i f f e r e n tID,a n ds i n c eo n l yo n et u p l ei so u t p u tf o re a c hg r o u p ,t h e r ei sn ou n i q u ew a yo fchoosing whichIDvalue to output. As a result, such cases are disallowed bySQL.3.7.3 The Having ClauseAt times, it is useful to state a condition that applies to groups rather than totuples. For example, we might be interested in only those departments where theaverage salary of the instructors is more than $42,000. This condition does notapply to a single tuple; rather, it applies to each group constructed by thegroupbyclause. To express such a query, we use thehavingclause ofSQL.SQLappliespredicates in thehavingclause after groups have been formed, so aggregatefunctions may be used. We express this query inSQLas follows:selectdept\nname,avg(salary)asavg', '88Chapter 3Introduction to SQL/* erroneous query */selectdept\nname,ID,avg(salary)frominstructorgroup bydept\nname;Each instructor in a particular group (deﬁned bydept\nname)c a nh a v ead i f f e r e n tID,a n ds i n c eo n l yo n et u p l ei so u t p u tf o re a c hg r o u p ,t h e r ei sn ou n i q u ew a yo fchoosing whichIDvalue to output. As a result, such cases are disallowed bySQL.3.7.3 The Having ClauseAt times, it is useful to state a condition that applies to groups rather than totuples. For example, we might be interested in only those departments where theaverage salary of the instructors is more than $42,000. This condition does notapply to a single tuple; rather, it applies to each group constructed by thegroupbyclause. To express such a query, we use thehavingclause ofSQL.SQLappliespredicates in thehavingclause after groups have been formed, so aggregatefunctions may be used. We express this query inSQLas follows:selectdept\nname,avg(salary)asavg', '88Chapter 3Introduction to SQL/* erroneous query */selectdept\nname,ID,avg(salary)frominstructorgroup bydept\nname;Each instructor in a particular group (deﬁned bydept\nname)c a nh a v ead i f f e r e n tID,a n ds i n c eo n l yo n et u p l ei so u t p u tf o re a c hg r o u p ,t h e r ei sn ou n i q u ew a yo fchoosing whichIDvalue to output. As a result, such cases are disallowed bySQL.3.7.3 The Having ClauseAt times, it is useful to state a condition that applies to groups rather than totuples. For example, we might be interested in only those departments where theaverage salary of the instructors is more than $42,000. This condition does notapply to a single tuple; rather, it applies to each group constructed by thegroupbyclause. To express such a query, we use thehavingclause ofSQL.SQLappliespredicates in thehavingclause after groups have been formed, so aggregatefunctions may be used. We express this query inSQLas follows:selectdept\nname,avg(salary)asavg', '88Chapter 3Introduction to SQL/* erroneous query */selectdept\nname,ID,avg(salary)frominstructorgroup bydept\nname;Each instructor in a particular group (deﬁned bydept\nname)c a nh a v ead i f f e r e n tID,a n ds i n c eo n l yo n et u p l ei so u t p u tf o re a c hg r o u p ,t h e r ei sn ou n i q u ew a yo fchoosing whichIDvalue to output. As a result, such cases are disallowed bySQL.3.7.3 The Having ClauseAt times, it is useful to state a condition that applies to groups rather than totuples. For example, we might be interested in only those departments where theaverage salary of the instructors is more than $42,000. This condition does notapply to a single tuple; rather, it applies to each group constructed by thegroupbyclause. To express such a query, we use thehavingclause ofSQL.SQLappliespredicates in thehavingclause after groups have been formed, so aggregatefunctions may be used. We express this query inSQLas follows:selectdept\nname,avg(salary)asavg', '3.7Aggregate Functions892.If awhereclause is present, the predicate in thewhereclause is applied onthe result relation of thefromclause.3.Tuples satisfying thewherepredicate are then placed into groups by thegroup byclause if it is present. If thegroup byclause is absent, the entireset of tuples satisfying thewherepredicate is treated as being in one group.4.Thehavingclause, if it is present, is applied to each group; the groups thatdo not satisfy thehavingclause predicate are removed.5.Theselectclause uses the remaining groups to generate tuples of the resultof the query, applying the aggregate functions to get a single result tuple foreach group.To illustrate the use of both ahavingclause and awhereclause in the samequery, we consider the query“For each course section offered in 2009, ﬁnd theaverage total credits (tot\ncred)o fa l ls t u d e n t se n r o l l e di nt h es e c t i o n ,i ft h es e c t i o nhad at least 2 students.”selectcourse\nid,semester,year,sec\nid,avg(tot']","No, the condition in the 'having' clause is not applied to a single tuple. It is applied to groups of tuples formed by the 'group by' clause. The 'having' clause is used to filter groups based on aggregate conditions.","No. The condition does not apply to a single tuple; rather, it applies to each group constructed by the group by clause. SQL applies predicates in the having clause after groups have been formed, so aggregate functions may be used.",0.977936069874558,0.9999999999833333,1.0,1.0,0.5710887065811456
13,Can 'having' clause present the attributes which do not appear in 'group by' clause?,"['88Chapter 3Introduction to SQL/* erroneous query */selectdept\nname,ID,avg(salary)frominstructorgroup bydept\nname;Each instructor in a particular group (deﬁned bydept\nname)c a nh a v ead i f f e r e n tID,a n ds i n c eo n l yo n et u p l ei so u t p u tf o re a c hg r o u p ,t h e r ei sn ou n i q u ew a yo fchoosing whichIDvalue to output. As a result, such cases are disallowed bySQL.3.7.3 The Having ClauseAt times, it is useful to state a condition that applies to groups rather than totuples. For example, we might be interested in only those departments where theaverage salary of the instructors is more than $42,000. This condition does notapply to a single tuple; rather, it applies to each group constructed by thegroupbyclause. To express such a query, we use thehavingclause ofSQL.SQLappliespredicates in thehavingclause after groups have been formed, so aggregatefunctions may be used. We express this query inSQLas follows:selectdept\nname,avg(salary)asavg', '88Chapter 3Introduction to SQL/* erroneous query */selectdept\nname,ID,avg(salary)frominstructorgroup bydept\nname;Each instructor in a particular group (deﬁned bydept\nname)c a nh a v ead i f f e r e n tID,a n ds i n c eo n l yo n et u p l ei so u t p u tf o re a c hg r o u p ,t h e r ei sn ou n i q u ew a yo fchoosing whichIDvalue to output. As a result, such cases are disallowed bySQL.3.7.3 The Having ClauseAt times, it is useful to state a condition that applies to groups rather than totuples. For example, we might be interested in only those departments where theaverage salary of the instructors is more than $42,000. This condition does notapply to a single tuple; rather, it applies to each group constructed by thegroupbyclause. To express such a query, we use thehavingclause ofSQL.SQLappliespredicates in thehavingclause after groups have been formed, so aggregatefunctions may be used. We express this query inSQLas follows:selectdept\nname,avg(salary)asavg', '88Chapter 3Introduction to SQL/* erroneous query */selectdept\nname,ID,avg(salary)frominstructorgroup bydept\nname;Each instructor in a particular group (deﬁned bydept\nname)c a nh a v ead i f f e r e n tID,a n ds i n c eo n l yo n et u p l ei so u t p u tf o re a c hg r o u p ,t h e r ei sn ou n i q u ew a yo fchoosing whichIDvalue to output. As a result, such cases are disallowed bySQL.3.7.3 The Having ClauseAt times, it is useful to state a condition that applies to groups rather than totuples. For example, we might be interested in only those departments where theaverage salary of the instructors is more than $42,000. This condition does notapply to a single tuple; rather, it applies to each group constructed by thegroupbyclause. To express such a query, we use thehavingclause ofSQL.SQLappliespredicates in thehavingclause after groups have been formed, so aggregatefunctions may be used. We express this query inSQLas follows:selectdept\nname,avg(salary)asavg', '88Chapter 3Introduction to SQL/* erroneous query */selectdept\nname,ID,avg(salary)frominstructorgroup bydept\nname;Each instructor in a particular group (deﬁned bydept\nname)c a nh a v ead i f f e r e n tID,a n ds i n c eo n l yo n et u p l ei so u t p u tf o re a c hg r o u p ,t h e r ei sn ou n i q u ew a yo fchoosing whichIDvalue to output. As a result, such cases are disallowed bySQL.3.7.3 The Having ClauseAt times, it is useful to state a condition that applies to groups rather than totuples. For example, we might be interested in only those departments where theaverage salary of the instructors is more than $42,000. This condition does notapply to a single tuple; rather, it applies to each group constructed by thegroupbyclause. To express such a query, we use thehavingclause ofSQL.SQLappliespredicates in thehavingclause after groups have been formed, so aggregatefunctions may be used. We express this query inSQLas follows:selectdept\nname,avg(salary)asavg', '88Chapter 3Introduction to SQL/* erroneous query */selectdept\nname,ID,avg(salary)frominstructorgroup bydept\nname;Each instructor in a particular group (deﬁned bydept\nname)c a nh a v ead i f f e r e n tID,a n ds i n c eo n l yo n et u p l ei so u t p u tf o re a c hg r o u p ,t h e r ei sn ou n i q u ew a yo fchoosing whichIDvalue to output. As a result, such cases are disallowed bySQL.3.7.3 The Having ClauseAt times, it is useful to state a condition that applies to groups rather than totuples. For example, we might be interested in only those departments where theaverage salary of the instructors is more than $42,000. This condition does notapply to a single tuple; rather, it applies to each group constructed by thegroupbyclause. To express such a query, we use thehavingclause ofSQL.SQLappliespredicates in thehavingclause after groups have been formed, so aggregatefunctions may be used. We express this query inSQLas follows:selectdept\nname,avg(salary)asavg', 'name,avg(salary)asavg\nsalaryfrominstructorgroup bydept\nnamehaving avg(salary)>42000;The result is shown in Figure 3.17.As was the case for theselectclause, any attribute that is present in thehavingclause without being aggregated must appear in thegroup byclause, otherwisethe query is treated as erroneous.The meaning of a query containing aggregation,group by,o rhavingclausesis deﬁned by the following sequence of operations:1.As was the case for queries without aggregation, thefromclause is ﬁrstevaluated to get a relation.\ndept\nname\navg(avg\nsalary)\nPhysics\n91000\nElec. Eng.\n80000\nFinance\n85000\nComp. Sci.\n77333\nBiology\n72000\nHistory\n61000\nFigure 3.17The result relation for the query“Find the average salary of instructors in thosedepartments where the average salary is more than $42,000.”']","No, any attribute present in the 'having' clause without being aggregated must appear in the 'group by' clause; otherwise, the query is treated as erroneous.","No. Any attribute that is present in the having clause without being aggregated must appear in the group by clause, otherwise the query is treated as erroneous",0.9484876615698637,0.9999999999833333,1.0,1.0,0.7452523520619083
14,Does 'count(*)' query ignore null values? How about other aggregate functions?,"['should ignorenullvalues in itsinput.In general, aggregate functions treat nulls according to the following rule: Allaggregate functions exceptcount (*)ignore null values in their input collection.As a result of null values being ignored, the collection of values may be empty. Thecountof an empty collection is deﬁned to be 0, and all other aggregate operations', 'should ignorenullvalues in itsinput.In general, aggregate functions treat nulls according to the following rule: Allaggregate functions exceptcount (*)ignore null values in their input collection.As a result of null values being ignored, the collection of values may be empty. Thecountof an empty collection is deﬁned to be 0, and all other aggregate operations', 'should ignorenullvalues in itsinput.In general, aggregate functions treat nulls according to the following rule: Allaggregate functions exceptcount (*)ignore null values in their input collection.As a result of null values being ignored, the collection of values may be empty. Thecountof an empty collection is deﬁned to be 0, and all other aggregate operations', 'should ignorenullvalues in itsinput.In general, aggregate functions treat nulls according to the following rule: Allaggregate functions exceptcount (*)ignore null values in their input collection.As a result of null values being ignored, the collection of values may be empty. Thecountof an empty collection is deﬁned to be 0, and all other aggregate operations', 'should ignorenullvalues in itsinput.In general, aggregate functions treat nulls according to the following rule: Allaggregate functions exceptcount (*)ignore null values in their input collection.As a result of null values being ignored, the collection of values may be empty. Thecountof an empty collection is deﬁned to be 0, and all other aggregate operations', 'idhaving count(ID)>=2;Note that all the required information for the preceding query is available fromthe relationstakesandstudent,a n dt h a ta l t h o u g ht h eq u e r yp e r t a i n st os e c t i o n s ,ajoin withsectionis not needed.3.7.4 Aggregation with Null and Boolean ValuesNull values, when they exist, complicate the processing of aggregate operators.For example, assume that some tuples in theinstructorrelation have a null valueforsalary.C o n s i d e rt h ef o l l o w i n gq u e r yt ot o t a la l ls a l a r ya m o u n t s :select sum(salary)frominstructor;The values to be summed in the preceding query include null values, since sometuples have a null value forsalary.R a t h e rt h a ns a yt h a tt h eo v e r a l ls u mi si t s e l fnull,t h eSQLstandard says that thesumoperator should ignorenullvalues in itsinput.In general, aggregate functions treat nulls according to the following rule: Allaggregate functions exceptcount (*)ignore null values in their input collection.As']","The `count(*)` query does not ignore null values; it counts all rows, including those with null values. Other aggregate functions, such as `sum`, `avg`, `min`, and `max`, ignore null values in their input collection. As a result, these functions only consider non-null values when performing calculations.","In general, aggregate functions treat nulls according to the following rule: All aggregate functions except count (*) ignore null values in their input collection. As a result of null values being ignored, the collection of values may be empty.",0.9136551933670506,0.9999999999833333,0.16666666666666666,1.0,0.83136938925001
